Título,Cuerpo,Dia y hora
El bloque conservador del Poder Judicial pretende forzar un pleno extraordinario para pronunciarse contra la amnistía,"La mayoría del bloque conservador del Consejo General del Poder Judicial (CGPJ), cuyo mandato está a punto de cumplir cinco años caducado, pretende que el pleno del órgano se pronuncie duramente contra la amnistía que preparan el PSOE y sus socios parlamentarios a los encausados del procés. Ocho de los 10 vocales propuestos por el PP que integran este sector han anunciado al presidente suplente, Vicente Guilarte, que este jueves registrarán una solicitud de pleno extraordinario en el que proponen que se vote una declaración institucional crítica con la medida de gracia que, afirman, “supone degradar y convertir” el Estado de derecho “en objeto de mercadeo al servicio del interés personal que pretende presentarse, desde el rechazo al pluralismo político, como el interés de España”. “El Consejo General del Poder Judicial expresa con esta declaración su intensa preocupación y desolación por lo que esa medida supone de degradación, cuando no de abolición, del Estado de derecho en España, que a partir del momento en el que se adopte pasará a ser una mera proclama formal que inevitablemente tendrá que producir consecuencias en perjuicio del interés real de España”, recoge el texto.
El núcleo duro del ala conservadora del CGPJ llevaba semanas gestando un pronunciamiento contra la amnistía, pero estaba a la espera de ver en qué se concretaba la iniciativa y si el PSOE, finalmente, la abanderaba. Los vocales de este sector consideran que ya, una vez que el presidente del Gobierno se mostró este fin de semana abiertamente partidario de promover la medida de gracia y horas después del acuerdo anunciado entre el PSOE y ERC que contempla esta medida, ha llegado el momento de salir al ataque desde el CGPJ, y no van a esperar ni siquiera a que los grupos registren la proposición de ley en el Congreso. La petición de pleno extraordinario está suscrita por ocho vocales, lo que implica que el presidente suplente tendrá que convocarlo forzosamente (tiene que hacerlo si lo piden cinco).
La decisión del PSOE de tramitar la amnistía como una proposición de ley y no como un proyecto del Gobierno acelera los trámites y evita, entre otros pasos, que el CGPJ emita un informe (no vinculante) sobre la medida, por lo que la declaración que plantean ahora los vocales conservadores sirve al órgano para expresar su opinión y hacerlo en unos términos mucho más políticos que técnicos. Los firmantes son ocho de los 10 consejeros propuestos por el PP que quedan en el órgano (tras la dimisión de Carlos Lesmes y la jubilación de Rafael Fernández Valverde): Carmen Llombart, José Antonio Ballestero, Francisco Gerardo Martínez-Tristán, Juan Manuel Fernández, Juan Martínez Moya, José María Macías, Nuria Díaz y María Ángeles Carmona. Solo se quedan fuera el presidente suplente y Wenceslao Olea, los dos vocales de este bloque que suelen ir más por libre. La postura que adopten estos dos consejeros va a determinar si la declaración institucional contraria a la amnistía sale adelante.
Fuentes del bloque progresista han expresado su rechazo tanto a la petición de pleno extraordinario como al texto de declaración institucional propuesta. “Lo hemos discutido muchas veces ya. Cuando no se nos pide nuestra opinión, no hay que darla, y mucho menos en esos términos”, señala un vocal de este sector. Otro consejero de este bloque considera que, si se convoca el pleno, el presidente podría incurrir en una “conducta contraria a derecho” porque el objetivo de la petición no guarda relación con competencias del CGPJ y supone “interferir en un acto parlamentario y constitucional como es un debate de investidura”. Un tercer vocal de este sector señala que espera que no se apruebe lo que considera “un panfleto grosero con frases textuales que ha dicho Feijóo”. “Por eso no quieren renovar el CGPJ, porque tienen una trinchera para atacar al Gobierno que utilizan cuando les conviene”, añade este vocal, que recuerda que “aunque es insólito que se pronuncie el CGPJ sobre cosas que ni siquiera se están tramitando, no es la primera vez que lo intentan”.
Los vocales que firman el escrito sostienen que la amnistía “violenta la independencia de los tribunales” y centran su crítica en el vínculo directo entre esta medida y la investidura de Pedro Sánchez. “Confundir el ‘interés de España’ con el interés del presidente del Gobierno en funciones para evitar la hipotética formación de gobiernos de partidos de una ideología diferente a la suya, es algo manifiestamente incompatible con la alternancia política, ínsita en el principio básico de pluralismo político que, según el artículo 1 de nuestra Constitución, es un valor superior de nuestro ordenamiento jurídico. Pero hacerlo, exceptuando la aplicación de la ley para impedir la acción en curso de los tribunales o dejar sin efecto la que ya se hubiese producido mediante sentencias firmes, convirtiendo en papel mojado esas sentencias, es algo rotundamente incompatible con el principio de Estado de derecho en el que, nuevamente según el artículo 1 de nuestra Constitución, se quiso constituir España y efectivamente se constituyó… al menos hasta ahora”, señalan los vocales.
Los vocales afirman que “cualquiera que sea la justificación formal o aparente que se le quiera dar en el preámbulo de la futura ley, su motivación real ya ha quedado expresada”, y no se detienen a analizar si una amnistía, de forma general, cabe en la Constitución porque consideran que, “lo que en ningún caso cabe aceptar es una amnistía, y ni tan siquiera un indulto particular de los admitidos genéricamente por la Constitución, con el fundamento real expresado por el Presidente del Gobierno en funciones”. Los consejeros sostienen que la medida de gracia “no es compatible con el principio de Estado de derecho” proclamado por el artículo 1 de la Constitución, “y ni tan siquiera con el principio de responsabilidad de los poderes públicos al que se refiere su artículo 9.3″.
Para estos vocales, la amnistía “supone generar una casta jurídicamente irresponsable e impune por sus delitos, lo que, con no justificarse en ningún fin constitucionalmente legítimo, supone contravenir no ya el principio de responsabilidad de los poderes públicos, sino incluso el más elemental principio de igualdad de los ciudadanos ante la ley que proclama el artículo 14 de la Constitución”. Por último, los consejeros que firman el escrito consideran que “lo que se violenta” con la medida de gracia anunciada “no solo es la Constitución”, sino también “los compromisos asumidos por España en los artículos 2 y 19 del Tratado de la Unión Europea para que en todo momento prevalezcan los principios de Estado de derecho e independencia judicial”. “El riesgo de que llegue el momento en el que la Unión Europea decida no ser la coartada de un Estado que no cumple con sus principios, debiera estar muy presente en este momento crítico, en la previsión de quienes pretendan realmente actuar en el ‘interés de España”, afirman estos vocales.",01 nov 2023 - 13:14 CET
Sánchez y Aragonès pactan la ley de amnistía y encarrilan la investidura ,"La investidura de Pedro Sánchez se acelera. El martes, el PSOE y ERC cerraron los extremos de la ley de amnistía que reclamaban los republicanos y que los socialistas tienen previsto presentar de forma inmediata en el Congreso, probablemente el jueves. El articulado no está cerrado definitivamente, porque aún hay que pactar algunos puntos con Junts, que se negociarán probablemente este miércoles, pero la parte que exigía ERC, que pedía una “amnistía completa” incluyendo a los encausados en la investigación por las protestas de la plataforma Tsunami Democràtic, sí se ha acordado.
El remate de la negociación se produjo en una conversación entre el presidente del Gobierno en funciones, Pedro Sánchez, y el presidente de la Generalitat, Pere Aragonès, según comunicaron los dos partidos pasadas las 22.00 del martes. El socialista había hablado hace dos semanas con el líder de ERC, Oriol Junqueras, pero las dos formaciones destacaron que fue Aragonès quien cerró la negociación, algo significativo internamente en ERC.
Según la nota de prensa, ambos presidentes “han desbloqueado los últimos detalles de la futura ley de amnistía” y se emplaza a los equipos negociadores de ambos partidos “al cierre definitivo, en las próximas horas” de los acuerdos pendientes en otras carpetas que estaban sobre la mesa y que “contendrán cuestiones políticas y económicas para desarrollar durante la XV Legislatura”. Teóricamente, allí estarían asuntos como el traspaso de Rodalies, el servicio de Cercanías de Renfe en Cataluña. El tono del comunicado es de investidura inminente. “La ley será registrada próximamente en el Congreso de los Diputados” y también los órganos de ERC someterán a votación los acuerdos muy próximamente.
La investidura de Sánchez parece así definitivamente encarrillada a falta de rematar los acuerdos con los otros aliados: PNV, Bildu y BNG. Todo está perfectamente medido. Primero fue el discurso de Sánchez ante el comité federal del PSOE defendiendo la amnistía el sábado; el lunes llegó la delicada foto del número tres de los socialistas, Santos Cerdán, con Carles Puigdemont en Bruselas. Y el siguiente paso, tras el acuerdo con ERC, es el registro en el Congreso de la ley de amnistía, hito previo a la investidura. El Gobierno y sus aliados trabajan con el escenario de registrarla esta semana, el jueves —este miércoles es festivo y no abre el registro— para que pueda ser calificada el viernes en la Mesa, que ya está convocada, y se pueda allí, en la Junta de Portavoces posterior, anunciar el pleno de investidura para la próxima semana. Como dijo Sánchez, “nada está cerrado hasta que todo está cerrado”, y, por tanto, todo podría cambiar en el último momento, pero los planes iniciales son estos.
La intención inicial es registrar la proposición de ley, que se lleva negociando semanas con Junts y ERC, con la firma de todos los grupos que apoyan la investidura —PSOE, Sumar, PNV, Bildu, BNG y los dos independentistas catalanes— pero aún tendrán que compartirla con los demás, porque se lleva con gran secreto. Hace dos meses, cuando planteó sus condiciones, Puigdemont insistió en que quería la ley aprobada antes de la investidura, algo que los socialistas veían inviable. No será así, pero, al menos, sí estará registrada y calificada por la mesa del Congreso para entonces, como forma de garantizar que la norma puede salir adelante.
Cuando los independentistas presentaron su propia ley de amnistía, en 2021, los letrados la rechazaron por inconstitucional, y no fue calificada. Sin embargo, fuentes de la negociación, aseguran que esta norma será completamente diferente a aquella, que se basaba en que no hubo ningún delito en el procés. Por tanto, la actual ley no debería tener ningún problema para iniciar su tramitación, que será larga y tortuosa porque la oposición será muy dura con ella. Además, el PP controla el Senado, donde puede entorpecer su marcha y retrasar los plazos, aunque no impedir que salga adelante, porque siempre tiene primacía el Congreso.
Además de la ley de amnistía, el pacto político, que prácticamente se sancionó con la foto de Puigdemont y Cerdán en Bruselas y ahora se remata con esta conversación entre Sánchez y Aragonès, incluye otros puntos que llevan semanas discutiéndose y que los socialistas confían en que suponga un acuerdo mucho más allá de una simple investidura; o, al menos, la garantía de aprobar los primeros Presupuestos, aunque el PSOE ha negociado con la intención de alcanzar un auténtico pacto de legislatura. Con Junts las cosas parecen muy amarradas, pero este grupo da por hecho que obtendrá algunos de los hitos que reclamaba, en especial el verificador para garantizar el cumplimiento de los acuerdos.
También da por hechos acuerdos sobre la lengua y lo que llaman el “reconocimiento nacional” de Cataluña y de cuyo avance a lo largo de la legislatura Junts espera condicionar su apoyo a Sánchez. Es un asunto sobre el que aún faltan muchas concreciones y todo se puede retrasar en el último momento, porque hay dos semanas más de margen para la investidura. El pacto a cinco bandas es muy complicado, en especial por la rivalidad entre Junts y ERC, pero los planes iniciales con los que trabajan los negociadores son muy claros e incluyen estos pasos decisivos los próximos días para concluir en la investidura la semana que viene.
En el PSOE defiende la foto que se hizo Cerdán con Puigdemont, que ha sido muy criticada por la oposición al tratarse del secretario de organización del PSOE junto a un expresident que huyó de su país en 2017 y lleva seis años esquivando a la justicia española. Los socialistas creen que en una negociación como esta, el Gobierno debe dar pasos y sostienen que la fotografía se hace con la intención de mostrar que lo que se está haciendo es “hablar para resolver problemas”. Fuentes de la dirección socialista aseguran que no están incómodos con esa fotografía porque supone dar un paso “para el reencuentro” y desbloquear además la investidura. Cerdán, según fuentes del PSOE, no sabía que Puigdemont lo iba a recibir en una sala presidida por un enorme cuadro en homenaje al referéndum del 1 de octubre de 2017, con una gran urna en primer plano. Lo que estaba pactado es que el PSOE haría la foto y el vídeo que se distribuyeron, y en ellas apenas se veía ese cuadro y no se apreciaba la urna. La foto que se envió a los medios fue pactada entre los dos grupos. En el PSOE minimizan la importancia del contexto de esa imagen, con el cuadro del referéndum en la sala, y destacan que lo relevante es que haya acuerdo. En cualquier caso, señalan que es impensable en una negociación exigir a uno de los interlocutores que cambie la decoración de su despacho para recibir al otro. El cuadro no se colocó para la cita, estaba allí y preside todos los encuentros del líder de Junts, que sigue reivindicando el referéndum y ha insistido en que nunca renunciará a la unilateralidad, una de las cuestiones que le reclamaron los socialistas durante la negociación. El encuentro duró una hora y llega después de muchas conversaciones de Cerdán con dirigentes de Junts y viajes discretos a París y otros lugares.
A falta de conocer el detalle del texto, el acuerdo entre el PSOE y ERC blinda que diferentes encausados por la causa del Tsunami Democràtic, el movimiento de protesta que nació tras la sentencia del procés, también sean beneficiados. Muchos de los activistas han sido absueltos, pero la supuesta cúpula de ese movimiento está siendo investigada por la Audiencia Nacional por delitos de terrorismo. Marta Rovira, secretaria general de ERC, y Josep Lluís Alay, exjefe de la oficina de Puigdemont cuando este era president, están en esa situación. Rovira, afincada en Suiza, afirmó hace meses que no regresaba a España por temor a que se le imputara ese delito.
ERC había dado a entender en los últimos días que había alguna divergencia sobre el alcance de la amnistía en la que trabajaban Junts y los socialistas. El lunes, la portavoz de los republicanos, Raquel Sans, abogó por más coordinación para obtener una “amnistía total”. El martes insistió en el mismo mensaje su homóloga del Govern, Patrícia Plaja, quien dijo que se debería incluir a “todos los casos de represaliados políticos, y esto también debe incluir la cuestión del Tsunami Democràtic”. Tras el comunicado emitido la noche del martes, fuentes de ERC ven ya todo subsanado.
Junts, y muy especialmente su fundador, se enfrenta ahora a la tarea de que en las bases se haga una buena digestión de un acuerdo que hace tan solo tres meses implicaba impugnar el camino de confrontación contra el Estado iniciado en 2017. Nada hace pensar que el expresident se vaya a encontrar con una contestación que descabalgue el pacto, ni por parte del Consejo Nacional ni en la consulta a las bases del fin de semana. Pero, por primera vez, Puigdemont se enfrenta a explicarse ante las bases. ERC está a la espera de que se cierre el acuerdo que hasta el martes primeras espadas de la formación insistían en calificar como aún crudo. El PSOE también terminará su consulta a la militancia para el fin de semana. 
Todo está listo, pues, para ir a la investidura la próxima semana. Y, si nada se tuerce, algo que siempre es posible en una negociación tan complicada, los días y los hitos de cada uno de ellos hasta alcanzar ese momento están negociados y tasados.",01 nov 2023 - 09:11 CET
El tortuoso camino para forzar en el Congreso una investidura inminente,"Nadie pone ya en duda en el Congreso y en todos los partidos, del Gobierno, aliados o de la oposición, que la investidura como presidente de Pedro Sánchez es inminente y solo hay especulaciones sobre la fecha concreta. En cualquier caso, es cuestión de días. La proposición de ley de amnistía a los imputados, procesados o condenados con relación al proceso independentista en Cataluña, que se pretende firmar por varios grupos parlamentarios para darle más sustento y relevancia, podría registrarse en las próximas horas; incluso antes de este fin de semana, con la idea de que la Mesa del Congreso aceptase su tramitación antes del debate de investidura, que se busca resolver la semana que viene.
Carles Puigdemont, el líder de Junts y expresidente de la Generalitat fugado de la justicia, abordó la tarde del lunes en una sala del Parlamento europeo durante una hora distintos flecos pendientes para el apoyo de los siete diputados de su formación a la investidura de Pedro Sánchez con el secretario de Organización y número tres del PSOE, Santos Cerdán. Fuentes que están al tanto de esa charla confirmaron que también hablaron de la fecha de ese debate, sin precisar más, lo que avanza a su vez la viabilidad de esa votación. En el Congreso, antes, durante y tras la solemne sesión de la jura de la Constitución por parte de la princesa Leonor, todos los actores políticos del país abordaron las distintas opciones para esa sesión.
Festividad del 1 de noviembre. En el PSOE han recibido la instrucción, al más alto nivel, de no abandonar Madrid en los próximos días, tras la festividad de este miércoles, con la previsión de que la proposición de ley que contemple esa amnistía pueda registrarse en el Congreso el jueves o el viernes, antes del fin de semana. La firmarán varios grupos de los que sostendrán al nuevo Gobierno de coalición presidido por Sánchez. Se trabaja contra reloj con el plan de que hasta la Mesa del Congreso lo pueda calificar (aceptar y aprobar que se empiece a tramitar regularmente, algo que durará meses) antes de que comience esa investidura; otro gesto político a las condiciones que marcó desde comienzos de septiembre el propio Puigdemont para dar su consentimiento a la continuidad de Sánchez en La Moncloa.
Reunión de la Mesa del Congreso el viernes. La Mesa del Congreso, que es la que debe dar el visto bueno a la aceptación de todas las iniciativas parlamentarias, está convocada para las 10.00 del viernes. El asunto de la amnistía aún no está en el orden del día. El PSOE o Sumar podrían forzar que se abordase al llevarlo in voce si fuese registrado el jueves. A pesar de que no está prohibido, incrustar un punto a tratar sobre la marcha no es un procedimiento habitual ni era el que más agradaba a la anterior presidenta del Parlamento, la socialista Meritxell Batet, que no los permitía.
Lunes, 6 de noviembre. También podría programarse una nueva reunión de la Mesa, específica al respecto y que por ahora no existe, para el lunes, con el objetivo de que el pleno de la investidura tuviese lugar con la máxima urgencia entre el martes 7 y el miércoles 8 de noviembre, en una primera sesión y votación. Se dejarían así las 48 horas preceptivas de margen formal para una teórica segunda votación, en caso de que no prosperase la primera, para el viernes 10. El PP, que tiene solo cuatro de los nueve componentes de la Mesa frente a los cinco de la mayoría progresista, votará en contra y reclamará informes de los letrados de la Cámara, que en el pasado se pronunciaron contra una propuesta similar de ERC en 2021. El Congreso está ahora en pleno proceso para relevar al letrado mayor y secretario general de la Cámara.
Congreso del Partido Socialista Europeo el 11 de noviembre. Pedro Sánchez se ha reservado el sábado 11 para acudir a Málaga a la clausura de un congreso del Partido Socialista Europeo, que estará allí reunido desde el día anterior, y querría llegar ya como presidente en pleno ejercicio y no en funciones. En el PSOE, Sumar y en otras formaciones aliadas, solo se contempla la posibilidad de que Sánchez salga elegido en la primera tanda por mayoría absoluta si antes se fragua el acuerdo que se está ultimando con Junts, ERC, PNV, EH Bildu y el BNG. Pero el calendario oficial debe prever la segunda votación.
Viaje de los Reyes del 6 al 8 de noviembre. La semana que viene, además, es tortuosa porque está ya llena de actos, eventos y viajes que podrían alterar estas previsiones. El lunes, los Reyes inician una visita de Estado a Dinamarca invitados por la reina Margarita que debería acabar en la noche del miércoles y que ya ha sido pospuesta en dos ocasiones. Cuando la investidura prospere, la presidenta de las Cortes, Francina Armengol, tendrá que acudir a La Zarzuela a comunicárselo a Felipe VI. Y, acto seguido, se constituirá y tomará posesión el nuevo Gobierno.
Sesión de control en el Senado el martes 7 de noviembre. La Mesa del Senado fijó para el martes de la semana que viene una sesión de control al Gobierno en funciones, que sería la primera de esta XV legislatura en su estrategia de usar esa institución, donde el PP disfruta de la mayoría absoluta, para obstruir los planes sobre la amnistía. Las preguntas para el presidente y los ministros deben cuadrarse antes del jueves. El Gobierno está obligado a acudir a esas sesiones, o a justificar y suplir su posible ausencia, como ya han hecho tres ministros. Si hubiera investidura en el Congreso el martes, el Senado tendría que reunir su Mesa precipitadamente para anular esa sesión.",01 nov 2023 - 07:56 CET
