Título,Cuerpo,Dia y hora
Amazon Go: así son los supermercados sin cajeros del gigante del comercio electrónico,"Solo 34 segundos. Es el tiempo medio que tarda un cliente en entrar a un supermercado de Amazon Go y salir con algún producto en sus manos, según asegura una empleada de uno de estos locales en Seattle. Este establecimiento destaca porque no tiene cajeros. “Sándwiches de desayuno por tres dólares”, se lee en un cartel amarillo en la entrada. Son las siete y media de la mañana y varias personas entran, cogen algún producto y se van sin hacer colas ni pasar por caja.
EL PAÍS ha visitado un Amazon Go ubicado en el centro de Seattle —en la esquina entre Terry Avenue y Stewart Street—, en un viaje al que ha sido invitado por el gigante del comercio electrónico. El supermercado abre de lunes a viernes de siete de la mañana a ocho de la tarde. Es bastante pequeño. Tiene tres pasillos y un techo repleto de cámaras que, según explica la empleada del local, “detectan a cada cliente como una entidad e identifican todo lo que coge”. Amazon no da muchos detalles sobre cómo funciona el sistema, pero indica que “aprovecha la visión por computadora, la fusión de sensores y el aprendizaje profundo”. “Todo lo que saques del estante se agrega automáticamente a tu carrito virtual y todo lo que vuelves a poner en él se retira del carrito virtual”, añade.
La mayoría de los clientes van con prisa y no interactúan entre ellos. Anna, de 37 años, suele acudir a este Amazon Go una o dos veces al mes. “Normalmente, hago la compra en otros supermercados, pero este es muy conveniente en caso de que quieras algo específico que no puedes encontrar en las máquinas expendedoras del trabajo, como este olipop de cola vintage”, afirma mientras muestra el refresco que acaba de comprar. Al poco tiempo sale del supermercado Nathan, un trabajador de Amazon de 42 años que dice acudir a ese establecimiento porque “tiene una selección bastante buena de productos y le permite entrar y salir rápidamente”.
La principal ventaja que citan varios clientes es la rapidez con la que pueden hacer sus compras. La mayoría de usuarios de este Amazon Go son trabajadores del edificio colindante, el Instituto de Investigación Infantil de Seattle, según cuenta una empleada del establecimiento. Es el caso de Chun-Yu Chen, de 40 años. Acude a este supermercado dos veces por semana. Además de la rapidez, destaca que como es cliente de Amazon Prime en ocasiones tiene descuentos.
La principal desventaja, según estos compradores, es que el local es pequeño. Mientras que Anna asegura que no reemplaza a un supermercado tradicional, Chen señala que “la comida siempre es la misma”. Nada más entrar hay varios platos preparados —como pasta, albóndigas, sushi o poke—, cuyo precio oscila entre los 8 y los 13 dólares, además de varias ensaladas y bocadillos. También hay todo tipo de snacks: de barritas energéticas a chocolatinas, patatas fritas de jalapeño y otros sabores, tiras de carne de venado o de wagyu o fruta cortada en envases de plástico.
Da la sensación de que todo está pensado para comer en el momento y salir de un apuro. Apenas hay alimentos sin cocinar: ni verduras, ni hortalizas, ni legumbres, ni pasta. Algunas de las bebidas que se venden son gigantescas. Es el caso de las energéticas o de la leche de vaca, soja o almendra. Los cartones son de 1,89 litros. Además, hay dos máquinas de café de Starbucks.
En el supermercado, también hay un estante con productos de Amazon Basics, como cables para cargar el móvil o pilas. Justo debajo hay ibuprofenos, paracetamoles o antihistamínicos, además de suplementos dietéticos que supuestamente sirven para “decir adiós al estrés”. “Estate tranquila y permanece alerta”, se lee en el envoltorio de uno de ellos. En esta zona también hay pasta de dientes, enjuague bucal, bolsas de basura, condones e incluso tests de embarazo.
Hay quienes evitan hacer sus compras en estos supermercados de Amazon. Es el caso de Jordan, una joven de 27 años que es responsable de servicios de voluntariado en una pequeña organización sin fines de lucro en Seattle. “Hay muchas razones por las que hago todo lo posible para no pedir cosas en Amazon o comprar en Amazon Go”, explica. Si bien le preocupa que el gigante del comercio electrónico pueda recopilar datos sobre sus hábitos de consumo, “no es la razón principal por la que evita comprar ahí”. “Sería difícil comprar algo en línea y que no recopilen los datos. Desafortunadamente, ese es el mundo en el que vivimos”, afirma.
Acto seguido enumera su lista de razones: “Amazon ha violado los derechos de los trabajadores durante años, vende sus servicios a empresas de combustibles fósiles, está dañando y sacando del negocio a las pequeñas empresas independientes, tiene acusaciones de racismo sistémico en sus oficinas y es agresivamente antisindical y, por lo tanto, contraria a los derechos de los trabajadores”.
Un portavoz de Amazon defiende que sus empleados tienen “salarios competitivos y beneficios que incluyen seguro médico privado, plan de pensiones y fondos para formación” y que su relación con las pequeñas y medianas empresas (pymes) es “de colaboración”. “Nuestro éxito depende de su éxito”, señala. Sobre la venta de servicios a empresas de combustibles fósiles, la compañía considera que “el sector energético debe tener acceso a las tecnologías más innovadoras, especialmente ahora que se enfrenta a una enorme transición energética”. Además, la compañía niega las acusaciones de antisindicalismo y dice tomarse muy en serio el “compromiso de respetar y valorar a las personas, sea cual sea su origen, género, raza, etnia, religión, orientación sexual y diversidad funcional”.
Actualmente, existen dos modalidades de supermercados. La mayoría tienen unas compuertas que se abren con la aplicación de Amazon, una tarjeta de crédito o la palma de la mano. Al salir de la tienda, la app cobra automáticamente los productos que el cliente se lleve. Pero en algunos establecimientos, como el situado entre Terry Avenue y Stewart Street en Seattle, el proceso es diferente. Cualquier persona puede entrar en ellos y es al salir cuando hay que pagar.
Para ello, es posible escanear la aplicación, utilizar la tarjeta de crédito o poner la palma de la mano sobre un lector. Este último sistema, conocido como Amazon One, solo está disponible para los usuarios que previamente hayan registrado su palma en unas máquinas que hay en el local. También existe la posibilidad de buscar a un empleado por el establecimiento y pagar con efectivo.
Hay quienes consideran que este tipo de supermercados podrían tener un efecto demoledor en el empleo. Que no haya cajeros no significa que no haya trabajadores en los establecimientos, según Amazon. De hecho, el gigante del comercio electrónico asegura que su “equipo de empleados en tienda es una parte importante de la experiencia en Amazon Go”. “Verás que los empleados saludan a los compradores en la puerta, resurten estantes, responden preguntas, ayudan con las devoluciones en línea de Amazon y hacen recomendaciones de productos”, indica la compañía.
Cuando EL PAÍS visitó este Amazon Go de Seattle, en él solo había una trabajadora, cuyo objetivo era resolver incidencias. Por ejemplo, la de un hombre que entró preocupado en el supermercado porque creía que se había ido sin pagar. “Creo que he hecho algo mal”, afirmó preocupado. Enseñó una bolsa de papel llena de productos y aseguró que no le habían cobrado ninguno mientras señalaba su móvil. La empleada le tranquilizó: el cobro y el envío del recibo suele tardar en producirse al menos una hora. Entre risas, el cliente abandonó el establecimiento.
Amazon estrenó el primer Amazon Go en Seattle en 2016. En total, hay 24 supermercados de este tipo en Seattle y el área metropolitana de esta ciudad, Chicago, Nueva York y Los Ángeles. La compañía ha cerrado este año ocho establecimientos mientras reevalúa su estrategia de tiendas físicas. Pese a los cierres, un portavoz de la compañía reafirmó a TechCrunch su compromiso con el formato Amazon Go: “Operamos más de 20 tiendas en EE UU y continuaremos aprendiendo qué ubicaciones y características resuenan más entre los clientes a medida que siguen evolucionando nuestras tiendas”. 
Amazon tiene además más de 60 Amazon Fresh en Estados Unidos y el Reino Unido. Estas tiendas, que venden productos básicos de uso diario y algunos productos de temporada, utilizan la misma tecnología que los Amazon Go. Es decir, los clientes pueden entrar en ellas, coger lo que quieran y marcharse sin necesidad de pasar por caja. El gigante del comercio electrónico supuestamente contemplaba la apertura de un centenar de Amazon Go en España, Alemania e Italia entre 2023 y 2024, según indicó el portal Inforetail en enero de 2022. Desde Amazon aseguran que nunca han confirmado tal información e insisten en que no hablan de planes de futuro. 
Puedes seguir a EL PAÍS Tecnología en Facebook y X o apuntarte aquí para recibir nuestra newsletter semanal.",01 nov 2023 - 08:02 CET
"Por qué la justicia condenó a Messi y absolvió a Alonso: la cesión de los derechos de imagen no es delito, pero ocultar sus ganancias, sí","El Tribunal Supremo acaba de confirmar la absolución del exfutbolista Xabi Alonso, actual entrenador del Bayer Leverkusen,  de tres delitos contra la Hacienda Pública en los ejercicios de 2010, 2011 y 2012 por los que la Fiscalía le había pedido dos años y medio de prisión. La acusación se centraba en un contrato suscrito por Alonso para ceder sus derechos de imagen a una empresa radicada en la isla portuguesa de Madeira, como hicieron muchos otros futbolistas profesionales que firmaron la cesión de estos derechos a sociedades asentadas en paraísos fiscales o territorios con baja fiscalidad. La misma sala que ahora ha absuelto a Alonso confirmó en 2017 la condena impuesta por la Audiencia Provincial de Barcelona a Leo Messi, cuyos padres habían firmado, cuando el futbolista argentino era todavía menor de edad, un contrato de cesión de derechos de imagen que el jugador ratificó al cumplir 18 años. ¿Cómo se explica una respuesta judicial tan diferente para prácticas con un origen similar? La sentencia del Supremo sobre Alonso explica por qué ambos casos no son equiparables.
El primer argumento del alto tribunal es de carácter técnico. Mientras Messi fue condenado en primera instancia (por la Audiencia de Barcelona), Alonso llegó al Supremo absuelto (por la Audiencia de Madrid) lo que, en gran medida, ató las manos de la Sala Penal para dar la vuelta a ambos pronunciamientos. No es que el Supremo no pueda absolver a un condenado o condenar a un absuelto, pero al deliberar un recurso de casación (los que se interponen ante el alto tribunal) no se puede alterar la valoración de las pruebas que hace el tribunal que juzga el caso. Y el que sentenció a Messi fue tan contundente diciendo que el contrato de derechos de imagen tenía como finalidad defraudar a Hacienda, como lo fueron los jueces que juzgaron a Alonso para concluir lo contrario (que no hubo fraude). A pesar de que el Supremo ve en el caso de Alonso algunos indicios que podrían apuntar a que su intención era defraudar (como la venta de los derechos a una empresa situada fuera de España), el rechazo de los jueces de la Audiencia (ratificado por el Tribunal Superior de Justicia de Madrid) a considerar fraudulento ese contrato, “condicionan el desenlace” de la causa en el alto tribunal, advierte la sentencia, de la que ha sido ponente el presidente de la Sala Penal, Manuel Marchena.
Pero al margen de este obstáculo inicial, la resolución del Supremo sobre Alonso permite concluir que la conducta del exfutbolista del Real Madrid no fue delictiva, mientras que la sentencia del caso Messi llegaba a una conclusión opuesta. Aunque en origen fueran aparentemente similares, las estrategias fiscales puestas en marcha por cada uno de ellos son muy distintas, según se deduce de ambas sentencias.
Alonso cedió la explotación de sus derechos de imagen a la empresa Kardzali en agosto de 2009, unos días antes de fichar por el Real Madrid y cuando todavía era jugador del Liverpool. La empresa estaba domiciliada en Madeira, una isla con un régimen fiscal especial que entonces eximía de pagar el Impuesto de Sociedades. Por esa cesión, Kardzali pagó al futbolista 288.305,47 euros en 2011 y 2.278.983,69 euros en 2012, y aunque el jugador no los incluyó en su declaración del IRPF, sí los declaró en el Impuesto sobre el Patrimonio. También presentó una declaración sobre bienes y derechos situados en el extranjero en la que se dejaba constancia de Kardzali. Aunque para Hacienda y la Fiscalía aquel contrato fue un negocio simulado, concebido como estrategia para defraudar a Hacienda, estas declaraciones presentadas por Alonso son claves para el Supremo, que considera que el actual entrenador del Bayer Leverkusen no ocultó al fisco sus ganancias.
Entre la Agencia Tributaria y el exfutbolista puede haber una “controversia jurídica” sobre en qué impuesto tenían que haberse declarado unos determinados ingresos, advierte el tribunal, pero eso no implica que exista delito contra la Hacienda Pública. “Cuando la liquidación presentada por el sujeto pasivo del impuesto [el contribuyente] hace aflorar en su integridad las ganancias obtenidas en cualquier actividad económica y ofrece a la Hacienda Pública una vía de tributación que los servicios de inspección consideran incorrecta, ese desencuentro interpretativo referido no al qué, sino al cuánto, no puede convertirse en el origen de un proceso penal”, señala el Supremo. La sentencia de la Sala Penal avala una práctica que ha sido habitual entre futbolistas (la cesión de los derechos de imagen a sociedades radicadas fuera de España) y que llevó a jugadores como Cristiano Ronaldo o Javier Mascherano a declararse culpables para alcanzar un pacto con la Fiscalía y evitar posibles penas más altas. Alonso optó por llevar su batalla hasta al final en los tribunales y el Supremo le ha dado la razón.
En el caso de Messi, la estructura puesta en marcha era mucho más compleja y su resultado, más opaco. El jugador argentino no firmó la cesión de sus derechos con una sola empresa, sino que primero lo hizo con una sociedad (a nombre de su madre y domiciliada en Belice), y al día siguiente esta los cedió a otra (del Reino Unido y de la que era administrador el padre y de otro acusado que firmó en nombre de una sociedad radicada en Uruguay). Poco después, estas sociedades formalizaron contratos de licencia, agencia o prestación de servicios con otras (en Suiza y el Reino Unido). La legislación de Belice y Uruguay permitía, según la sentencia de la Audiencia Provincial de Barcelona, asentarse en su territorio a sociedades “con opacidad en cuanto a la identidad de sus propietarios y rentas”. “No exigían la presentación de declaraciones fiscales ni informes o cuentas anuales, eximiendo de la tributación por las rentas obtenidas fuera de su territorio”, recuerda el tribunal. El Reino Unido y Suiza eran también países “con una amplia red de convenios suscritos para evitar la doble imposición, y cuya legislación no penalizaba fiscalmente las operaciones realizadas con sociedades residenciadas en países como Belice y Uruguay”.
Al contrario de Alonso, que informó a Hacienda de sus ingresos, aunque no los declarara en el IRPF, los Messi consiguieron que las ganancias obtenidas por el jugador no pasaran por la administración tributaria española. Según la sentencia que condenó al futbolista argentino, las cuotas dejadas de ingresar en Hacienda por Messi alcanzaron las cifras de 1.064.626,62 euros, en el ejercicio de IRPF del 2007; 1.584.601,09 euros, por el IRPF del año 2008, y 1.536.775,41 euros por el de 2009. La defensa del jugador y su padre había sostenido, durante el juicio oral celebrado en junio de 2016 en Barcelona, que el futbolista había confiado sus obligaciones con Hacienda a su padre y este a sus asesores. “Con ingenua pretensión exculpatoria de un comportamiento, para el que incluso se llega a recabar elogio, el recurso alude a la búsqueda por el acusado de unos profesionales dignísimos y de alta formación técnica específica que tendría por única finalidad poder satisfacer mejor los deberes tributarios. Tal alegato resulta poco serio”, concluyó el Supremo, que no se creyó que los Messi no supieran que tenían que tributar a Hacienda. “De ello cabe concluir que cuando el acusado acude al despacho profesional no es para que este le informe sobre cuál sea su obligación tributaria y cómo darle adecuado cumplimiento, sino para que le indiquen cómo lograr eludirlo”, concluyó la sala.
Sigue toda la información de Economía y Negocios en Facebook y X, o en nuestra newsletter semanal",01 nov 2023 - 08:01 CET
"Jaume Roures, su traumático adiós a Mediapro y las facturas pendientes","Era un hervidero. Centenares de personas colapsaban los caminos entre el Dragon Khan y Ferrari Land. Jaume Roures y Tatxo Benet, fundadores de Mediapro, habían cerrado Port Aventura para los 7.000 trabajadores de la productora, que a mediados de junio de 2019 celebraba su 25 aniversario. Ataviados con camisetas conmemorativas de color verde lima y bajo el lema Jo també vaig ser-hi! (¡Yo también estuve allí!), la plantilla no solo celebraba un éxito empresarial impredecible para muchos, sino también una forma de alcanzarlo. No era difícil apreciar el sentimiento de pertenencia de quienes, con sus familias, entre DJ y conexiones con las delegaciones de Miami o Bogotá, se acercaban con dificultad hasta los jefes para, simplemente, estrecharles la mano. Casi un lustro después de aquel festejo, Roures (Barcelona, 1950) era forzado este viernes a abandonar su propia casa, la que fundó en 1994 y a pocos meses de llegar a las tres décadas al frente de la misma. El enemigo exterior, que tantas veces sirvió para aunar a los suyos, esta vez estaba dentro.
Su verdugo no tiene cara conocida, pero tiene nombre: Southwind Media. Se trata de la firma de inversión hongkonesa que atesora el 85% del capital de la compañía desde que los problemas financieros derivados del Covid obligaron a los socios históricos a buscar fondos a cambio de perder control. Aseguran fuentes empresariales conocedoras del desencuentro que Roures no comparte ni la filosofía que busca imponer el dueño asiático, contraria a los principios fundacionales de la casa, ni la estructura societaria que viene, con un propietario al que no es difícil rastrear vinculaciones con el mundo de las apuestas y el juego. Benet y el equipo directivo, que se quedan, no parecen albergar esa desazón. El desgarro en la casa es inefable.
Los roces escenificados por ambas partes en la salida así lo atestiguan. Entre denuncias de censura, Roures aseguró que “fue Tatxo quien me dijo que los canales internos de la empresa no se podían utilizar para cosas que no fuesen convenientes”, lo que le obligó a despedirse de la plantilla desde su correo personal. El ejecutivo se negó a asumir el término “desvinculación” para explicar su adiós y dejó claro que no se quedará de brazos cruzados y abrazará nuevos proyectos.
Trotskismo en la empresa
“Hablamos de un trotskista irredento, incombustible”, explica un compañero de fatigas que se define como su amigo y recuerda sus tiempos en la catalana Liga Comunista Revolucionaria y el paso por la cárcel, allá por los años setenta. Una época de lucha en la que coincidió con comunistas ilustres, como Manuel Vázquez Montalbán, buen conocedor de las celdas de la Modelo. “De forma más o menos consciente, para lo bueno y para lo malo, él ha trasladado esa filosofía, ese espíritu, a las guerras empresariales. Por ejemplo, la sensación de ser perseguido y el carácter indómito. También el feroz individualismo y un inconformismo casi patológico”, reflexiona. Suficiente para entender su salida de Mediapro a los 73 años, de su proyecto vital, por sus desencuentros con el principal accionista.
Con este enfoque se lanzó a las denominadas ‘guerras del fútbol’, conflicto que Mediapro mantuvo durante años con el grupo Prisa (compañía editora de El País y CincoDías) y que incluso obligó a la productora a declararse en concurso voluntario de acreedores en el año 2010. Al final, en los estertores de los años ochenta, el tándem Roures-Benet inventó -o desde luego, sublimó- un negocio de la nada, esto es, la adquisición de los derechos audiovisuales de los clubes de fútbol para luego comercializarlos. Las televisiones, probablemente el eslabón débil de la cadena, aguantaron entonces y resisten hoy, en gran parte porque el crecimiento del negocio futbolístico en términos empresariales ha sido exponencial. Benet y Roures tuvieron visión. Con Mediapro como agencia exclusiva para la comercialización internacional de los derechos televisivos, La Liga ha pasado de unos ingresos de 150 millones en la temporada 2009-2010, a más de 700 en la 2021-2022. La compañía factura hoy 1.200 millones.
El adiós de Jaume Roures de Mediapro, de hecho, abre un frente cuyo impacto solo el tiempo podrá medir. Como la fórmula de la Coca-Cola, la obtención de esos valiosos derechos, a menudo adquiridos tras subastas más o menos transparentes, se ha rodeado en estos años de secretismo y de un halo misterioso, un laberinto del que Roures parecía conocer todas las salidas. No falta quien en el sector simplifica ese know-how aludiendo a la condición del ejecutivo barcelonés como interlocutor privilegiado de actores clave del mundo del deporte y la comunicación, un valor irremplazable para cualquier organización. Aquí también juegan las querencias y el carácter del propio empresario, conocido como ‘Melan’ durante sus años de afiliación política por sus accesos de melancolía. Hermético y parco en palabras, tiene fama de no fallar a los suyos. Sus silencios han reforzado el carácter místico de un negocio a priori sencillo, pero que Mediapro ha parecido ejercer por momentos en términos de monopolio por nolo contendere.
De los fracasos al cine
No todo han sido éxitos, empero, en estos años. Su proyecto más personal, realizado al margen de Mediapro, el diario Público, arrojó pérdidas de decenas de millones de euros en apenas tres años y se vio obligado a bajar la persiana de manera traumática, con un elevado coste para los profesionales que apostaron por sumarse a la apuesta editorial. Su recompra posterior de la cabecera le granjeó un rosario de críticas. Luces y sombras presenta la aventura de La Sexta, en cuyo accionariado participaba de forma indirecta. Tras invertir más de 600 millones en un lustro, los accionistas -encabezados por la Televisa de Emilio Azcárraga Jean- pasaban página y le encontraban cobijo en Atresmedia, donde se ha garantizado la supervivencia, aunque lejos de la idea original. La participación del 7% en la cadena de Planeta que obtuvo el conglomerado en aquella operación permitió a Benet ocupar un sillón en el consejo de la cadena. Capacidad de influencia, cero. Las pupilas de Roures se iluminan cuando habla de cine y de las películas producidas, entre otros, a Woody Allen. Su nombre figura en títulos de crédito de cintas que son ya clásicos del celuloide.
La pregunta del millón es qué va a hacer ahora el poliédrico y esquivo empresario. Fuentes de su entorno aseguran que ni él mismo lo sabe, aunque también deslizan que, pese al palo recibido, está mejor de ánimo y más entero que cuando salió de forma abrupta de TV3. Después, creó de la nada todo un imperio. Entonces iba del brazo de Benet, hoy supera los 70 años. Está por ver también cómo se resuelve la venta de su 5% en Mediapro, un porcentaje que no tiene sentido mantener a la vista de su desafección con el proyecto del accionista mayoritario y que, a tenor de la valoración de la compañía, puede reportarle cerca de 100 millones de euros. Su filosofía de vida no va a cambiar y quienes le conocen lo saben bien. Corría el año 2009 y Roures comparecía en el Hotel Ritz de Madrid, pantalones vaqueros desgastados y americana negra, ante lo más granado de la comunicación. “Somos gente corriente que pica piedra”, descerrajó con intención para alejarse de toda etiqueta y distinguir su proyecto. Desde el viernes, ya no es el suyo.
Sigue toda la información de Cinco Días en Facebook, X y Linkedin, o en nuestra newsletter Agenda de Cinco Días
Gracias por leer Cinco Días",01 nov 2023 - 05:15 CET
