Título,Cuerpo,Fecha,Periódico,Enlace
"Un terremoto de magnitud 6,4 deja al menos 136 personas muertas en Nepal","Un devastador terremoto de magnitud 6,4 en la escala Richter ha sacudido Nepal en las últimas horas, dejando a su paso una estela de muerte y destrucción. Según el portavoz del Ejército nepalí, Krishna Prasad Bhandari, se han confirmado al menos 136 muertos y 140 heridos hasta el momento. Además, cientos de hogares han sufrido daños considerables, lo que podría elevar el número de víctimas mortales a medida que avancen las operaciones de rescate.
Guerra entre Israel y Hamás, en directo: tanques israelíes rodean la Ciudad de Gaza y hay combates cuerpo a cuerpo
Las enfermizas fotos que Brueckner le hizo a Madeleine McCann antes de deshacerse del cuerpo 
""Los judíos son descendientes de los monos y los cerdos y hay que matarlos""
Los distritos de Rukum y Jajarkot, ubicados en la zona oeste del país, han sido los más afectados por el sismo, con 28 y 20 víctimas fatales confirmadas respectivamente. Sin embargo, se espera que el recuento de muertos aumente a medida que se evalúen las áreas afectadas. La Policía ha indicado que proporcionará detalles adicionales una vez que amanezca.
El impacto del terremoto también se sintió en el norte de la India, incluida su capital, aunque hasta el momento no se han reportado víctimas ni daños significativos en esa región. El Centro Nacional de Sismología de la India estima que la magnitud del sismo alcanzó los 6,4.
Este trágico suceso revive los recuerdos del devastador terremoto de magnitud 7,8 que sacudió Nepal el 25 de abril de 2015, cobrando la vida de casi 9.000 personas y dejando a más de 22.000 heridos. Esa catástrofe también dejó a cientos de miles de personas sin hogar y causó daños por valor de miles de millones de euros. A pesar de los esfuerzos de reconstrucción en curso, la pandemia ha ralentizado significativamente el progreso en la recuperación.",04.11.2023 16:17,larazones,https://www.larazon.es/internacional/terremoto-magnitud-64-deja-menos-136-personas-muertas-nepal_20231104654660a6b27615000197c61e.html
Las enfermizas fotos que Brueckner le hizo a Madeleine McCann antes de deshacerse del cuerpo ,"Los investigadores del caso Madeleine McCann siguen buscando algún posible error cometido por Christian Brueckner en el secuestro y asesinato de Madeleine McCann. Do momento, tienen muchos indicios y testimonios contra él pero ninguna prueba sólida, a pesar de que el fiscal de Braunschweig y principal responsable de la investigación, Hans Christian Wolters, indicara hace ya más de 3 años que el caso estaba resuelto al 90 por ciento.
Guerra entre Israel y Hamás, en directo: tanques israelíes rodean la Ciudad de Gaza y hay combates cuerpo a cuerpo
Un terremoto de magnitud 6,4 deja al menos 136 personas muertas en Nepal
""Los judíos son descendientes de los monos y los cerdos y hay que matarlos""
Sin embargo, les falta una prueba definitiva, algo que una al sospechoso y a Madeleine de forma inequívoca. Durante los años previos de investigación, el equipo de Wolters descubrió la voracidad que Brueckner tenía con sus víctimas y su gusto por los ""trofeos"" de caza. En la vivienda en la que residió en Portugal y en una nave abandonada de su propiedad en Alemania se encontraron varios discos duros con abusos sexuales a menores, violaciones e imágenes de una extrema crudeza. Por allí por donde pasaba, documentaba los abusos y tiempo después se deshacía de ellos.
Por ello, está convencidos que tiene que haber imágenes de Madeleine muerta escondidas por algún lugar. Por ello el pasado mes de mayo acudieron al embalse de Arade, sitio que Brueckner habría calificado como ""su pequeño paraíso"".
Durante las escasa 48 horas que duró la investigación, extrañó que las prospecciones de terreno fueran tan pequeñas. Se limitaron a abrir pequeños agujeros en el suelo, de escasa profundidad. Ahora, según desvela el diario britànico ""The Sun"", el objetivo de ese registro era buscar discos duros o material informático que pudiera esconder imágenes de Madeleine McCann muerta.
Según revela el tabloide, los investigadores ""saben que Christian Brueckner enterró soportes de datos como discos duros y memorias USB en los lugares donde estuvo, así que esa era la verdadera esperanza que tenían los investigadores en el registro en el lago. Realmente pensaban que allí encontrarían fotografías, pero no pierden la esperanza. Creen que hizo duplicados de las imágenes porque le encanta conservarlos como trofeos. Así que ahora la policía está intentando averiguar más sobre los movimientos de Christian B"".
Una esperanza que muchos consideran que no tiene mucho sentido después de que las autoridades citaran al principal sospechoso en 2013 para preguntarle sobre su paradero el día de la desaparición de Madeleine. Tras declarar fue puesto en libertad y tuvo tiempo suficiente para destruir pruebas.
Y es posible que esto hubiera ocurrido pero los investigadores confían en que su obsesión por coleccionar imágenes a modo de trofeos le llevara a hacer duplicados de algunas de ellas.
Brueckner pasaba largas temporadas en Portugal pero realizaba viajes por Europa hasta 2015. El día de la desaparición de Madeleine, su teléfono le sitúa muy cerca de los apartamentos de Praia da Luz a la hora de la desaparición. Los detectives sospechan que visitó el remoto embalse de Arade en los días posteriores a la desaparición de Madeleine. Durante los meses siguientes residió en Villa Bianca, en el pueblo de Foral, en el Algarve. Pero también pasó algún tiempo en Alemania, donde pasó por Dresde, Augsburgo Sylt o Munich.
Pero el tiempo pasa y Brueckner no ha sido llevado hasta el juez por lo que muchas personas cercanas al caso consideran que la fiscalía alemana se enfrenta a la única oportunidad que le queda para aclarar el destino de Madeleine porque no habrá otra. Las pistas más relevantes ya han sido investigadas y revisadas y tampoco hay nuevos testimonios relevantes.
Mientras tanto Kate y Gerry siguen esperando novedades del caso y sueñan con poder reencontrarse con su hija y poder darle el descanso que se merece. En todos estos años, ha permanecido al margen de la investigación. En esta última etapa, los investigadores alemanes no les han proporcionado ningún tipo de información porque les consideran testigos y podrían jugar un papel relevante en el caso de que todo terminara en juicio. La única información que se les proporcionó fue 24 horas antes de la comparecencia de Wolters para anunciar que Brueckner era el principal sospechoso del secuestro y asesinato en Portugal de Madeleine McCann. La semana pasada se conoció que una delegación de investigadores portugueses viajaron a primeros a de año a Reino Unido para disculparse por los errores cometidos en el inicio de la investigación y por haberles considerado sospechosos durante un año.",04.11.2023 13:01,larazones,https://www.larazon.es/internacional/europa/enfermizas-fotos-que-brueckner-hizo-madeleine-mccann-antes-deshacerse-cuerpo_20231104654632b4f6ca7200014b60d1.html
"""Los judíos son descendientes de los monos y los cerdos y hay que matarlos""","“Los judíos son descendientes de4 los monos y los cerdos y hay que matarlos”. Hamás cuenta con basto aparato educativo-mediático para adoctrinar a los niños desde una edad muy temprana para que amen la yihad, dediquen sus vidas a luchar contra los judíos y busquen el martirio como la gloria suprema que es altamente recompensada en el Paraíso. Este adoctrinamiento es complementado y amplificado por los padres, especialmente las madres, que expresan alegría por el martirio de sus hijos y su voluntad de sacrificar a todos sus hijos por la causa. 
Guerra entre Israel y Hamás, en directo: tanques israelíes rodean la Ciudad de Gaza y hay combates cuerpo a cuerpo
Un terremoto de magnitud 6,4 deja al menos 136 personas muertas en Nepal
Las enfermizas fotos que Brueckner le hizo a Madeleine McCann antes de deshacerse del cuerpo 
Parte de este adoctrinamiento, --informa Memri-- se lleva a cabo a través de múltiples plataformas, como los jardines de infancia, las escuelas y los campamentos de verano de Hamás. Se enseña a los niños que emprender la yihad es un deber religioso y que el martirio le otorga al creyente una recompensa mayor en el cielo que cualquier otra acción. o virtud.
Aprenden que el objetivo de la yihad es liberar Palestina, desde el río hasta el mar, de los judíos, que no tienen derecho a existir allí, y eliminar el Estado de Israel. Los mensajes impartidos a los niños están repletos de motivos antisemitas que demonizan a los judíos, presentándolos como los enemigos eternos de los musulmanes, como ""descendientes de simios y cerdos"" infrahumanos y como salvajes sedientos de sangre con quienes no es posible ningún diálogo o reconciliación.
Además del adoctrinamiento ideológico y religioso, los niños pequeños y adolescentes también reciben entrenamiento militar intensivo como preparación para unirse al ala militar de Hamás o a una de las otras organizaciones terroristas cuando sean adultos. Esta formación tiene lugar en las escuelas de Hamás, pero especialmente en la amplia red de campamentos de verano de la organización. A los que asisten cientos de miles de participantes cada año, los campos cultivan un ""espíritu de resistencia"" e inculcan un compromiso con la lucha armada intransigente contra Israel, al mismo tiempo que enseñan una amplia gama de habilidades de combate. Muchos de ellos llevan el nombre de terroristas que llevaron a cabo operaciones armadas y ataques suicidas contra civiles israelíes. Las Brigadas Izz Al-Din Al-Qassam entrenan a los niños con cuchillos y armas de fuego (en algunos casos con munición real); combate mano a mano; ejercicios de marcha y a pie, y combate en túneles.
Otra plataforma importante para el adoctrinamiento son los medios de comunicación de Hamás. Sus canales de televisión, por ejemplo, transmiten programas, algunos dirigidos a niños en edad preescolar, que inculcan valores de la yihad y el martirio y glorifican a los terroristas a través de dibujos animados, canciones, poemas y espectáculos de marionetas.",04.11.2023 12:37,larazones,https://www.larazon.es/internacional/judios-son-descendientes-monos-cerdos-hay-que-matarlos_2023110465462d1032499c0001bbeb62.html
Muere una mujer de 39 años tras ser apuñalada en una calle de Getafe,"Una mujer de 39 años ha fallecido este sábado tras ser agredida en la avenida Arcas del Agua, en el municipio madrileño de Getafe, ha informado Emergencias 112 de la Comunidad.
Detenido en Madrid un hombre por abusos sexuales a menores durante más de un año
Madrid prohíbe desde hoy acceder en patinete eléctrico al transporte público
Siete heridos en una reyerta en el interior de una discoteca en Azca
Hasta el lugar se ha desplazado la Policía Científica y el Grupo VI de homicidios de la Policía Nacional, cuya principal línea de investigación es que pudiera tratarse de un asesinato de carácter machista, han informado a EFE fuentes policiales.
No hay detenidos y se desconoce si la víctima había sufrido anteriormente violencia machista, pero es una de las hipótesis que se barajan.
Los servicios de emergencias ha recibido a las 13:45 horas un aviso telefónico en el que se alertaba de que una mujer había sufrido una agresión en la vía pública y presentaba varías heridas de arma blanca.
Al lugar de los hechos han acudido la Policía Nacional, la Policía Local y el Summa 112, cuyos sanitarios han realizado maniobras durante veinte minutos de reanimación cardiopulmonar avanzada.
No ha sido posible revertir la parada y los sanitarios han confirmado el fallecimiento de la mujer.
""La Policía investiga el asesinato de una mujer en Getafe por posible violencia machista, su asesino habría huido. En estos momentos tan difíciles todo nuestro pesar y apoyo está con su familia y amigos. Seguimos recopilando más información"", ha escrito en su cuenta de X (antes Twitter) la alcaldesa de Getafe, Sara Hernández.
De confirmarse que se trata de un crimen machista, ésta sería la víctima número 52 en lo que va de año en España y la 1.237 desde 2003, cuando se empezaron a registrar.
El 016 atiende a todas las víctimas de violencia machista las 24 horas del día y en 52 idiomas diferentes, al igual que el correo 016-online@igualdad.gob.es; también se presta atención mediante WhatsApp a través del número 600000016, y los menores pueden dirigirse al teléfono de la Fundación ANAR 900 20 20 10.
En una situación de emergencia, se puede llamar al 112 o a los teléfonos de la Policía Nacional (091) y de la Guardia Civil (062) y en caso de no poder llamar se puede recurrir a la aplicación ALERTCOPS, desde la que se envía una señal de alerta a la Policía con geolocalización.",04.11.2023 16:49,larazones,https://www.larazon.es/madrid/fallece-mujer-39-anos-ser-apunalada-calle-getafe_202311046546680ef6ca7200014bca3c.html
Detenido en Madrid un hombre por abusos sexuales a menores durante más de un año,"Un hombre fue arrestado en Madrid por la presunta agresión sexual a dos menores, una niña de 12 años y un niño de 14, durante un período de más de un año. Según las declaraciones de los menores, el acusado se introducía en sus camas para realizar tocamientos de carácter sexual. La denuncia inicial provino del tío de los menores, quien confrontó al presunto agresor tras escuchar el relato de los niños y resultó herido en el proceso. Sorprendentemente, los abusos no cesaron a pesar de que los menores informaron a su madre en múltiples ocasiones, quien presuntamente hizo caso omiso de sus reclamos y ha sido detenida conjuntamente con el agresor.
Muere una mujer de 39 años tras ser apuñalada en una calle de Getafe
Madrid prohíbe desde hoy acceder en patinete eléctrico al transporte público
Siete heridos en una reyerta en el interior de una discoteca en Azca
La investigación actual también incluye el análisis del teléfono móvil del acusado, ya que se sospecha que intercambiaba mensajes con otros menores y que podría contener imágenes de carácter sexual de los mismos. Este caso arroja luz sobre los desafíos persistentes en la lucha contra el abuso infantil y la importancia de crear un entorno seguro para que los niños y niñas se sientan empoderados para denunciar situaciones de este tipo.
Según un estudio presentado por la ONG 'Save the Children', la edad media de inicio de los abusos sexuales en casos similares en España es de 11 años, y en un 80,3% de los casos, las víctimas son niñas o adolescentes. Además, el 96% de los abusadores no tiene antecedentes penales relacionados con la violencia sexual. Esto resalta la necesidad de una mayor concienciación y prevención de este tipo de delitos. En 2021, se presentaron 8.317 denuncias por delitos contra la libertad sexual de niños, niñas y adolescentes, lo que subraya la urgencia de abordar este problema de manera efectiva.
Los datos también muestran que muchas víctimas se ven obligadas a declarar múltiples veces antes de un juicio, lo que puede ser traumático, y solo en el 24,9% de los casos se utilizó la prueba preconstituida para evitar repeticiones. 'Save the Children' subraya que el abuso sexual infantil es una de las formas más graves de violencia contra los niños y adolescentes, y un problema que sigue siendo subestimado y oculto. En consecuencia, se hace un llamado a la sociedad y a las autoridades para que se intensifiquen los esfuerzos en la prevención, la detección temprana y la protección de los menores contra el abuso sexual.",04.11.2023 16:32,larazones,https://www.larazon.es/madrid/detenido-madrid-hombre-abusos-sexuales-menores-mas-ano_202311046546641c32499c0001bc5e51.html
Madrid prohíbe desde hoy acceder en patinete eléctrico al transporte público,"El acceso de usuarios con patinete o monociclo eléctrico está prohibido desde hoy en las instalaciones y vehículos del transporte público de la Comunidad de Madrid por razones de seguridad, después del incidente registrado el pasado día 17 al explotar la batería de uno de estos dispositivos en el interior de un tren que se encontraba en la estación de La Elipa, en la Línea 2 de Metro.
Muere una mujer de 39 años tras ser apuñalada en una calle de Getafe
Detenido en Madrid un hombre por abusos sexuales a menores durante más de un año
Siete heridos en una reyerta en el interior de una discoteca en Azca
La medida entra en vigor en la red de transportes públicos de la Comunidad cuya gestión sea competencia del Consorcio Regional de Transportes (CRTM). En concreto, afectará a los autobuses de la Empresa Municipal de Transportes de Madrid (EMT) e interurbanos y urbanos en otros municipios, así como a la red de Metro de Madrid y Metros ligeros y los cinco intercambiadores de Plaza de Castilla, Moncloa, Príncipe Pío, Plaza Elíptica y Avenida de América. 
La restricción permanecerá en vigor hasta que se promulgue la correspondiente normativa al respecto, aunque en todo caso será por un máximo de 9 meses, según la resolución publicada en el Boletín Oficial de la Comunidad de Madrid (BOCM). Durante ese tiempo, según explicó el Gobierno regional, será para verificar completamente las condiciones de seguridad de este tipo de elementos en el transporte público.
El incumplimiento de la normativa conllevará la inmediata expulsión de los infractores, que además tendrán que hacer frente a multas económicas de entre 100 y 200 euros, según el CRTM.
La medida ha sido trasladada operador estatal Renfe Cercanías y a los concesionarios de las concesiones estatales de transporte de viajeros por carretera que efectúan trayectos entre Castilla-León y Castilla La Mancha y la Comunidad de Madrid, con las cuales esta última mantiene convenio, ya que los usuarios que porten estos vehículos de movilidad personal no podrán utilizar las infraestructuras de transporte de la Comunidad de Madrid para entrar o abandonar el sistema de transporte público.
Además, para velar por el cumplimiento de esta resolución, el CRTM solicitará a los operadores implicados la difusión este cambio en sus canales de información digitales e impresos, como redes sociales, páginas web, cartelería, paneles o vinilos informativos.
""Lo que queremos nosotros es garantizar por encima de todas las cosas la seguridad no solo de los madrileños y también de los viajeros que utilizan el transporte público, sino al mismo tiempo también garantizar la seguridad de todos los trabajadores que prestan y desempeñan sus funciones en las infraestructuras del transporte"", ha subrayado el consejero de Vivienda, Transportes e Infraestructuras, Jorge Rodrigo.
La Autoritat del Transport Metropolità (ATM) del área de Barcelona también tiene vigente una prohibición temporal de subir patinetes eléctricos al transporte público y otros vehículos de movilidad personal por ""seguridad"". Además, en Sevilla está restringido el acceso en patinete en los vagones de Metro en hora punta los días laborales.
El consejo de administración del CRTM está integrado por representantes de la Comunidad de Madrid, Ayuntamiento de la capital y el resto de consistorios de la región, así como de la Administración General del Estado, organizaciones sindicales y asociaciones empresariales del sector y de consumidores y usuarios.",04.11.2023 14:03,larazones,https://www.larazon.es/madrid/madrid-prohibe-hoy-acceder-patinete-electrico-transporte-publico_2023110465464129f6ca7200014b825e.html
Siete heridos en una reyerta en el interior de una discoteca en Azca,"La Policía Nacional ha detenido esta mañana a cuatro hombres por supuestamente agredir con arma blanca a los porteros de una discoteca de los bajos de Azca, en la calle madrileña de Orense, distrito de Tetuán, en una reyerta que se ha saldado con siete heridos, dos de ellos graves.
Muere una mujer de 39 años tras ser apuñalada en una calle de Getafe
Detenido en Madrid un hombre por abusos sexuales a menores durante más de un año
Madrid prohíbe desde hoy acceder en patinete eléctrico al transporte público
Los detenidos, todos varones y de nacionalidad española, eran clientes de la discoteca situada en el número 24 de la calle Orense y han sido arrestados como presuntos autores de delitos de lesiones graves, han informado a Efe fuentes policiales.
La Policía Nacional continúa investigando los motivos que desencadenaron la discusión que terminó con la agresión de los porteros en el interior del establecimiento.
Los hechos ocurrieron hacia las 6:00 horas de este sábado en los bajos de Azca, en la calle de Orense, y como consecuencia de la reyerta dos hombres han sufrido heridas de consideración y otras cinco personas han resultado heridas leves, con contusiones, según Emergencias Madrid.
Los dos heridos de consideración, ambos de 27 años de edad, son un varón con herida por arma blanca en la parte izquierda del abdomen, quien ha sido trasladado al hospital de La Paz, y otro varón que sufre traumatismo craneoencefálico y facial y que ha sido trasladado potencialmente grave al Hospital Clínico.
El Servicio de Asistencia Municipal de Urgencias-Protección Civil (Samur-PC) también ha atendido en el lugar a siete pacientes de 18, 19, 20 y 30 años de edad, con heridas y contusiones leves, y a un varón de 45 años con una herida leve por arma blanca en la ingle, que ha sido trasladado al hospital Gregorio Marañón.",04.11.2023 13:52,larazones,https://www.larazon.es/madrid/siete-heridos-reyerta-interior-discoteca-azca_2023110465463ea5f6ca7200014b7cba.html
"Rescatada una excursionista accidentada en la Sierra de Hoyo, en Collado Villalba, en una operación de película","Un helicóptero del GERA (Grupo de Rescate en Altura) ha acudido esta mañana al rescate de un excursionista que había sufrido una rotura de pierna en la madrileña Sierra de Hoyo, en Collado Villalba, en una complicada operación que, finalmente, ha resultado ser un éxito, pese al fuerte viento y las nubes bajas, dos grandes dificultades que han puesto a prueba la pericia del piloto.
Muere una mujer de 39 años tras ser apuñalada en una calle de Getafe
Detenido en Madrid un hombre por abusos sexuales a menores durante más de un año
Madrid prohíbe desde hoy acceder en patinete eléctrico al transporte público
El helicóptero tuvo que evacuar a la accidentada, una mujer de unos 40 años de edad desplegando una grúa desde el helicóptero. Después, la trasladó al helipuerto de Moralzarzal, el más cercano, desde donde fue trasferida a una UVI del SUMMA. Con la mujer fue trasladada una enfermera del SUMMA, que había acudido al lugar junto con un equipo. El helicóptero volvió a la zona de rescate para evacuar al resto del equipo que había acudido al rescate para terminar en el helipuerto de Navacerrada, tal y como ha informado Ataire, la Asociación de Trabajos Aéreos de Emergencias (Ataire), a través de la red social X, quien ha puesto en valor la imprescindible labor de los medios aereos.",04.11.2023 13:34,larazones,https://www.larazon.es/madrid/rescatada-excursionista-accidentada-sierra-hoyo-collado-villalba-operacion-pelicula_2023110465463a3db276150001977822.html
Intoxicados 50 niños de cuatro guarderías en una localidad de Tarragona,"Un inusual incidente ocurrió en Calafell, Tarragona, donde alrededor de 50 niños y niñas de cuatro guarderíasexperimentaron reacciones adversas después de consumir el mismo menú. Los síntomas se manifestaron mientras los menores estaban comiendo o poco después de hacerlo en los centros educativos. Por suerte, los síntomas que presentaron fueron leves, y todos los afectados fueron atendidos, con 38 de ellos en el Hospital de El Vendrell y el resto en el centro de salud de la localidad. Aunque no se descarta que pueda haber más afectados que no hayan buscado atención médica.
Le Corbusier, el arquitecto que pintaba
Las bases de ERC validan el acuerdo de investidura y el partido ya negocia el mediador con el PSOE
Puigdemont complica el calendario de Sánchez
Las cuatro guarderías involucradas en este incidente, El Petit Trenet, Els Terrossets, El Rasclet y El Petit Príncep, ofrecieron el mismo menú a los niños afectados. El alcalde de Calafell, Ramón Ferré, ha expresado su desconcierto sobre la causa de la intoxicación y ha anunciado que están ""a la espera de los resultados de los análisis y estudios epidemiológicos para determinar el origen de este incidente"". A pesar de la incertidumbre inicial, Ferré confirmó que ""todos los niños se encuentran en buen estado en la actualidad y no presentan síntomas o reacciones adversas notables"".
Las autoridades locales seguirán investigando este inusual suceso a medida que buscan respuestas sobre las posibles causas de la intoxicación en las guarderías de Calafell.",04.11.2023 19:00,larazones,https://www.larazon.es/cataluna/tarragona/intoxicados-50-ninos-cuatro-guarderias-localidad-tarragona_20231104654686c1b276150001980ffa.html
