Título,Cuerpo,Fecha,Periódico,Enlace
El encarecimiento del azúcar y el aceite amenaza el precio de los polvorones esta Navidad,"A medida que se acerca la temporada navideña, las fábricas de polvorones en España se encuentran en pleno rendimiento, pero este año se enfrentan a un desafío inusual: el encarecimiento del aceite y el azúcar. El precio del polvorón, un dulce tradicionalmente asociado a las festividades navideñas, se ha visto afectado por la subida de dos ingredientes esenciales en su elaboración. El azúcar ha triplicado su precio en los últimos dos años, y el aceite se ha vuelto el doble de caro en comparación con el año anterior debido a la inflación.
El máximo riesgo de contagio frente a una persona con covid es a los cinco segundos
Galicia se lleva la peor parte de Domingos: vientos de más de 170 km/h y ríos desbordados
Acertijo matemático: ¿Eres capaz de encontrar los valores correctos?
Este aumento en los costos de producción plantea un dilema a los productores y distribuidores de polvorones y mantecados, ya que temen tener que trasladar este aumento a los precios finales y, por ende, a los consumidores. En busca de soluciones, algunas localidades como Villajoyosa han implementado medidas para aliviar los gastos en aceite. En este caso, el Ayuntamiento ha otorgado permisos a 40 familias para recolectar las aceitunas de los 600 olivos de propiedad municipal, lo que ha permitido un ahorro significativo para los beneficiarios. A pesar de los desafíos, la tradición navideña de disfrutar de polvorones y mantecados sigue viva en España, y se espera que estos deliciosos dulces estén disponibles para las celebraciones festivas, aunque a un precio ligeramente más elevado.",04.11.2023 18:39,larazones,https://www.larazon.es/sociedad/encarecimiento-azucar-aceite-amenaza-precio-polvorones-esta-navidad_20231104654681c332499c0001bc9bd7.html
"Carrascal, un comunicador único y atrevido, como su historia (y corbatas)","Recordar a José María Carrascal es hacerlo de sus míticas corbatas, de un tono de voz inconfundible, pero sobre todo de su capacidad para hacer periodismo de una manera distinta. Informar sin renunciar al dardo en la palabra, a la personalidad, al concepto único de un comunicador que también lo fue. Es por eso que podemos afirmar que el pasado viernes por la noche saltaba la noticia de la muerte en su residencia madrileña del periodista y escritor José María Carrascal a los 92 años. Periodista y escritor, como tantos, pero no como el resto. 
Las lágrimas de Lola Índigo que no pudo contener con Pablo López en ""La Voz""
Con una dilatada carrera profesional José María Carrascal nació en Madrid, en la localidad de El Vellón en 1930. En la noche del viernes dejaba atrás más de seis décadas dedicadas a la profesión. Esta misma semana había cumplido con su artículo en Abc sobre la jura de la Constitución de la princesa Leonor.
Lejos quedan aquellos comienzos en los que José María abandonó su Madrid natal para ser corresponsal para los diarios Pueblo y Diario de Barcelona. Primero lo haría en la ciudad alemana de Berlín durante ocho años y después en Estados Unidos, en Nueva York para ser exactos. Fue esa época donde trabajó para el diario Abc y también colaboró con la cadena de radio de Antena 3 y RTVE. Allí firmó uno de los trabajos que le popularizó, la mítica entrevista al expresidente de Estados Unidos, Ronald Reagan.
Diez años después de la aventura americana en la Gran Manzana decidió regresar a España.
Lo curioso es que la vida le tenía reservada una etapa profesional mucho más expuesta de lo que había vivido hasta ahora, el gran salto que lo convirtió en un rostro muy popular. Fue por eso que con el nacimiento de las televisiones privadas debutó como presentador en la incipiente Antena 3 a sus casi 60 años. Nada menos. Algo inaudito. «Y así salió», reconocería después. En 1989 se hizo cargo de los informativos con «Noticias a las ocho». Recordaba tiempo después cómo había sido el primer día, el estreno, junto a Matías Prats en una visita al exitoso programa de la misma cadena «El Hormiguero» esa puesta en marcha en la que todo era nuevo también para la cadena: «Yo estaba tranquilísimo. Nos tirábamos a una piscina en la que no habíamos mirado si había agua. No es que fuera yo nuevo, sino que lo era todo el equipo. Todo el mundo era recién salido de la universidad sin experiencia. Tal era nuestra irresponsabilidad que a mí me pusieron un realizador venido de la televisión gallega el día antes y me dijo ‘te voy a poner de pie y con dos cámaras’ y yo contesté ‘pues sí’. Y el telepromter, era un jueves, había llegado el lunes de Japón y ni el señor que lo manejaba sabía manejarlo ni yo leerlo. Y allí no entraba ningún vídeo», comentaba con ironía.
A pesar de ello, tardó muy poco en hacerse un hueco entre los espectadores y en 1990 pasó a dirigir las «Noticias de la noche» donde su presencia cada noche se alargó durante los siguientes siete años alcanzando una gran popularidad. Marcó una manera diferente de hacer informativos y fue precursor en introducir la opinión en ellos. También encontró lugar para el humor sin perder el rigor. Y, por supuesto, se le recordará por la variedad de sus pintorescas corbatas que él mismo definía con «personalidad». Su tono de voz, sus tiempos, silencios y forma de expresarse lo hicieron único.
En 1997 llegó la hora de la despedida, de decir adiós, y decidió dejar la televisión y seguir su vida laboral en Prensa escrita, donde la había comenzado. Desde entonces escribió como columnista en el diario Abc y también en LA RAZÓN. A estas alturas ya era prolífico también como escritor con más de una veintena de obras publicadas, aunque como él mismo afirmó en alguna ocasión «la televisión había borrado todo lo demás». 
Cada noche, durante muchas, se despidió de su audiencia con un «Nos vemos al filo de la medianoche». Y el viernes al filo de esa medianoche nos enterábamos de que un grande de la comunicación se había ido. 
José María Carrascal estuvo más de seis décadas en activo. Desde que se fue a Berlín de corresponsal hasta el final de sus días. Esta misma semana publicó su último artículo que versaba sobre la Princesa Leonor. Le dio tiempo a sumar un amplio número de galardones, entre los que destacan: el premio Nadal (1972), por su novela Groov; el Mariano de Cavia; la Antena de Oro de la televisión; el Premio Nacional Emilio Romero al periodista del año (1992); Premio Periodista Audiovisual (1993-94) de la Asociación Nacional de Informadores Gráficos; y el Luca de Tena (2021).",04.11.2023 19:06,larazones,https://www.larazon.es/television/carrascal-comunicador-unico-atrevido-como-historia-corbatas_2023110465468819b2761500019812e2.html
"Rescatada una excursionista accidentada en la Sierra de Hoyo, en Collado Villalba, en una operación de película","Un helicóptero del GERA (Grupo de Rescate en Altura) ha acudido esta mañana al rescate de un excursionista que había sufrido una rotura de pierna en la madrileña Sierra de Hoyo, en Collado Villalba, en una complicada operación que, finalmente, ha resultado ser un éxito, pese al fuerte viento y las nubes bajas, dos grandes dificultades que han puesto a prueba la pericia del piloto.
Muere una mujer de 39 años tras ser apuñalada en una calle de Getafe
Detenido en Madrid un hombre por abusos sexuales a menores durante más de un año
Madrid prohíbe desde hoy acceder en patinete eléctrico al transporte público
El helicóptero tuvo que evacuar a la accidentada, una mujer de unos 40 años de edad desplegando una grúa desde el helicóptero. Después, la trasladó al helipuerto de Moralzarzal, el más cercano, desde donde fue trasferida a una UVI del SUMMA. Con la mujer fue trasladada una enfermera del SUMMA, que había acudido al lugar junto con un equipo. El helicóptero volvió a la zona de rescate para evacuar al resto del equipo que había acudido al rescate para terminar en el helipuerto de Navacerrada, tal y como ha informado Ataire, la Asociación de Trabajos Aéreos de Emergencias (Ataire), a través de la red social X, quien ha puesto en valor la imprescindible labor de los medios aereos.",04.11.2023 13:34,larazones,https://www.larazon.es/madrid/rescatada-excursionista-accidentada-sierra-hoyo-collado-villalba-operacion-pelicula_2023110465463a3db276150001977822.html
¿Qué provincia española tiene la mayor concentración de Arte Románico de toda Europa?,"La provincia de Palencia, el lugar ideal para desconectar en familia o con amigos este otoño
¿Qué espectacular iglesia es la más antigua del románico de la provincia de Segovia?
¿Cuáles son los Castillos Románicos más imponentes de Castilla y León?
El Arte Románico surgió en la región francesa de Borgoña, a finales del siglo X como un forma de construir de la Orden Benedictina que tiene su casa madre en la abadía de Cluny (Francia). Este nuevo estilo se extendió a través de los caminos de peregrinación, especialmente el de Roma y el Camino de Santiago.
El arte románico fue el primer gran estilo claramente cristiano y europeo que agrupó a las diferentes opciones que se habían utilizado en la temprana Edad Media (romana, prerrománica, bizantina, germánica y árabe) y consiguió formular un lenguaje específico y coherente aplicado a todas las manifestaciones artísticas.​ No fue producto de una sola nacionalidad o región, sino que surgió de manera paulatina y casi simultánea en España, Francia, Italia, Alemania y en cada uno de esos países surgió con características propias, aunque con suficiente unidad como para ser considerado el primer estilo internacional, con un ámbito europeo.
 
Surgió como consecuencia de la prosperidad material y de la renovación espiritual que inspiró la construcción de gran número de iglesias y de edificios religiosos. Las primeras construcciones​ se hicieron en Lombardía, Borgoña y Normandía. Desde allí se difundió por toda Europa, debido a: -Expansión de las órdenes religiosas (Cluny y Císter) que construyen monasterios. Estos son fuente de riqueza y centro cultural y urbano de la sociedad.
-Las peregrinaciones (en España el románico se introduce a través del Camino de Santiago).
-Aumento de la influencia de la iglesia.
Debido a las relaciones entre religiosos y nobles, los reyes, nobles, obispos y abades de los monasterios impulsaron la construcción de las grandes iglesias y a veces eran aldeanos quienes las costeaban y construían. Las obras las realizaban artesanos especializados como arquitectos, picapedreros, pintores, etc. El Arte Románico fue sobre todo un arte religioso, que reflejaba los valores de la nueva sociedad feudal, que a la vez era guerrera y cristiana.
En España adquiere sus propias peculiaridades dejándose influir tanto por las modas que le llegan desde el exterior a través de Italia y Francia como por la tradición y recursos artísticos antiguos en la Península Ibérica.
Mientras en el siglo VIII se pudo sentir en la Europa cristiana occidental la restauración carolingia, la España cristiana siguió apegada a la cultura tradicional hispanorromana y goda, sin dejarse influir por los movimientos culturales europeos, hasta la llegada del románico.
La arquitectura románica se extendió en España en la mitad norte llegando hasta el río Tajo, en plena época de Reconquista y repoblación, en especial tras la conquista de Toledo (1085) que aseguró la paz al norte del Duero y favoreció en gran medida su desarrollo. Entró tempranamente en primer lugar por tierras catalanas de los condados de la Marca Hispánica donde desarrolló un primer románico y se extendió por el resto con la ayuda del Camino de Santiago y de los monasterios benedictinos.
 
Pero nuestro país adquirió mucho protagonismo en este arte, hasta el punto que una provincia española es la que cuenta con la mayor concentración de Arte Románico de toda Europa. 
La provincia de Palencia cuenta con 234 monumentos de estas características. Todos ellos tienen en común el ofrecer al visitante una completísima lección de historia, de arte y de cultura. Desde las pequeñas ermitas que parece que siempre formaron parte del paisaje, hasta grandes conjuntos monásticos, pasando por todo tipo de motivos arquitectónicos o decorativos, los monumentos románicos palentinos son una de las mejores y más agradables formas de conocer este estilo artístico, puesto que en ellos podemos encontrar todos sus rasgos distintivos.
Existen tres zonas fundamentales en torno a las cuáles la concentración es mayor: - Siguiendo el Camino de Santiago. 
-En el Sur, alrededor de la ciudad de Palencia. 
-En la zona Norte, en una amplia comarca de la que Aguilar de Campoo es cabecera.
 
Siguiendo el trazado que emplean los peregrinos, arranca así un recorrido por el Románico del Camino por el que llegaron a tierras palentinas otras formas de componer las claves de este arte. 
Frómista
En esta población es visita más que obligada el templo de San Martín de Tours (B.I.C.). Esta iglesia es uno de los ejemplos siempre citados del arte románico. Construida en el siglo XI, consta de tres naves y crucero destacado en planta y rematado por una bella linterna. Sus capiteles merecen una atenta y reposada visita. Está considerado este edificio arquetipo y síntesis del estilo románico. Solo con la presencia de San Marín de Tours el viajero estaría al alcance de comprender cual es el significado que se encierra tras la escala, el espacio y los volúmenes de una arquitectura hecha para el recogimiento.
 
Población de Campos
En este municipio se puede disfrutar de la sencilla Ermita de San Miguel del siglo XIII, a la entrada del pueblo junto al cementerio de la localidad y, ya a la salida del mismo, junto al río y al Camino, el turista se encuentra con la pequeñita Ermita del Perpetuo Socorro siglo XIII.
Villalcázar de Sirga
Sobre el paisaje terracampino sobresale, por encima del caserío de la villa, la monumental fábrica de su iglesia parroquial de Santa María la Blanca. Es Monumento Histórico Artístico desde 1919 y se fecha su construcción en el siglo XIII, edificada en el más puro estilo gótico. Su planta consta de tres naves, separadas por pilares y cubierta de crucería. 
 
La puerta principal, se abre al mediodía, precedida de un pórtico con arquería apuntada y cubierto con bóveda de crucería, que cobija dos portadas de arquivoltas apuntadas, con columnas acodilladas y figuras de santos y apóstoles. Sobre la puerta principal figura un doble friso con esculturas de los Apóstoles, presididas por la imagen de Cristo y la Virgen bajo arquería.
En el interior, sobresalen su soberbio retablo mayor del siglo XVI, cuyo centro lo ocupa la imagen pétrea de la Virgen Blanca (siglo XIII) y donde el maestro Alejo narra con sus pinturas sobre tabla, la vida de Cristo completándola con diversos santos. En la capilla funeraria de Santiago, se pueden admirar los dos afamados y bellos sepulcros de piedra policromada de la primera mitad del siglo XIII, en los que yacen el Infante don Felipe, hijo del rey Fernando III el Santo y hermano de Alfonso X el Sabio y el de la que hasta hoy, se creía de su segunda esposa doña Leonor Ruiz de Castro y que según las últimas investigaciones, realmente pertenece a su cuarta esposa, doña Inés Téllez Girón. Asimismo, en esta misma capilla, hay que hacer notar la presencia del retablo renacentista de Santiago (siglo XVI) y una bella imagen sedente de la Virgen de Villasirga..
Carrión de los Condes
La localidad más grande que el peregrino y el turista encontraran en el trazado de la Ruta Jacobea a su paso por Palencia. La iglesia de Santa María de las Victorias y del Camino (B.I.C.), románica del siglo XII con reformas posteriores, posee una bella portada con la Adoración de los Reyes Magos. 
La Iglesia-museo de Santiago (B.I.C.), románica del siglo XII, con una portada magnifica; un espectacular Pantocrátor y su tetramorfos, preside junto a los 12 apóstoles, la portada de acceso decorada con una arquivolta historiada que representa a diversos oficios.
 
El Monasterio de San Zoilo (B.I.C.), construido en el siglo X, conserva una portada románica del siglo XI, que da paso a la iglesia donde en el espacio del sotocoro se encuentran los sepulcros románicos y góticos de hombres ilustres y de los famosos infantes de Carrión, supuestamente casados con las hijas del Cid Campeador.
Aunque el Románico Palentino se concentra principalmente en el norte de la provincia, en su parte sur también pueden admirarse algunos monumentos singulares. Obligado punto de arranque es la cripta de la Catedral de Palencia, primera construcción de la región castellana que utiliza las técnicas constructivas románicas y que fue edificada en torno 1035, apoyándose en un antiguo edificio visigótico, cuando fue restaura la diócesis de Palencia en tiempos del Rey Sancho el Mayor.
Villamuriel de Cerrato
Se trata del antiguo lugar de descanso de los prelados palentinos. Su parroquia de Santa María la Mayor, es una bella y a la vez sobria construcción de comienzos del siglo XIII cuya torre es una de las más altas de la provincia. Destaca en el conjunto su cimborrio y la portada norte, que nos recuerda al foco del románico zamorano.
Dueñas 
Destaca el Monasterio Cisterciense de San Isidro, conocido como la Trapa. Fue fundado por los benedictinos en el siglo IX, conservando de esa época su portada de ingreso a la iglesia abacial. También en la iglesia parroquial de la Asunción de Dueñas veremos algunos restos románicos que nos recuerdan su antiguo origen, aunque mucho de lo que allí veremos ya es de tiempos góticos. 
 
Comarca del Cerrato palentino
En esta zona se puede visitar la Basílica visigótica de San Juan de Baños, en Baños de Cerrato, y desde allí el visitante visitará Cevico Navero, donde su iglesia parroquial de Nuestra Señora de la Paz conserva restos románicos del siglo XII. Otro tanto se puede observar en Villaconancio, donde su iglesia de San Julián y Santa Basilisa nos mostrará dos bellos ábsides del románico lombardo. También Castrillo de Onielo conserva vestigios románicos en su iglesia de Nuestra Señora de la Paz, así como Vertavillo en la de San Miguel. La iglesia de Alba de Cerrato fue muy reformada en el siglo XVII, pero en su cabecera se conserva su ábside románico-mudejar.
Tierra de Campos
En esta zona se puede visitar la ermita de Grijota, la portada de la iglesia de San Pedro en Becerril de Campos, la soberbia torre románica de Torremormojón, y ya cerca de Ampudia la iglesia de San Fructuoso en Valoria del Alcor.
En el curso alto del Pisuerga, las comarcas de Cervera de Pisuerga y Aguilar de Campoo hasta los límites con Cantabria y Burgos ofrecen tal concentración de edificios y restos románicos que deberemos dividir nuestro viaje en tres rutas para ver al menos lo más destacable.
Aguilar de Campoo 
El municipio acoge la ruta de los monasterios, ya que partiendo de Santibáñez de Ecla se puede visitar el Monasterio de San Andrés de Arroyo, típico monasterio cisterciense fundado a fines del siglo XI, que es una verdadera joya del arte palentino en el que destaca su claustro, iglesia y sala capitular.
También resaltan los restos de San Andrés, la iglesia de Santa Cecilia situada a los pies del castillo, y para finalizar visita obligada será el monumental monasterio de Santa María la Real, que fue fundado en el siglo IX.
 
Moarves de Ojeda
En este pueblo se puede admirar la ""encendida encarnación"" cómo describiría Unamuno, del friso de la portada de su iglesia parroquial de San Pedro, donde quedan representadas las cotas de elegancia que puede alcanzar el románico norteño palentino.
Olmos de Ojeda
Acoge la iglesia del que fuera monasterio femenino de Santa Eufemia de Cozuelos. Este templo fue edificado en el siglo XII, mostrando la influencia de los talleres canteros de Frómista y San Andrés de Arroyo.
Perazancas
Es uno de los pueblos más representativos del románico palentino. La iglesia parroquial, comenzada a construir de forma suntuosa, conserva una bella portada románica y su ábside. Pero lo más llamativo de esta villa es la ermita de San Pelayo, primor del románico lombardo con pinturas murales del siglo XII. 
Vallespinoso de Aguilar
En este pueblo se puede descubrir sobre un alto la esbelta ermita de Santa Cecilia, y bordeando el pantano de Aguilar el turista llegará a Barrio de Santa María, donde rodeada de casas blasonadas se levanta su iglesia parroquial, que conserva el ábside románico, y a las afueras la ermita de Santa Eulalia, pequeña joya del románico palentino.
Lomilla 
Esta localidad cerca de Aguilar, es un ejemplo de las pequeñas iglesias del Norte, y siguiendo la Autovía de la Meseta en dirección Palencia, el visitante encontrará las iglesias de los dos últimos monasterios: la de San Vicente en Becerril del Carpio y Santa María de Mave. Su iglesia fue construida a principios del siglo XIII, y es uno de los más completos edificios románicos de la región.
Matalbaniega
Su iglesia de San Martín domina el pueblo desde una loma. Debió de pertenecer a un conjunto monacal y su colección de canecillos así lo corrobora.
Cillamayor
Cuenta con una parroquia está dedicada a Santa María la Real, y en ella también sobresale la interesante colección de canecillos que la adornan. Dominando sobre un agradable paisaje se construyó la iglesia de Villanueva de la Torre. De corte popular, a diferencia de otras de la zona que llevan espadaña, ésta se embellece con una sencilla y sobria torre. También es aconsejable visitar la bella, esculturada y bien conservada portada de Revilla de Santullán, los restos de la iglesia de Brañosera y el pintoresco caserío de Salcedillo con una iglesia de sabor popular.
Cervera de Pisuerga
La localidad acoge multitud de pequeños pueblos donde siempre se encuentran algún vestigio románico.
La primera parada del recorrido es la iglesia de San Cornelio y San Cipriano en San Cebrián de Mudá, con reformas góticas e importantes obras de arte, que muestra una típica espadaña, elemento frecuente en las iglesias norteñas.
 
Cervera de Pisuerga, mantiene aún el empaque de su hidalguía en sus fachadas blasonadas, los aleros tallados y su plaza porticada de columnas de piedra, así como toda la magia del paisaje que la rodea.
San Salvador de Cantamuda
Cabecera del Valle de Pernía, como nos lo recuerda su rollo jurisdiccional del siglo XVI. Su iglesia formó parte de un antiguo monasterio y se construyó en 1181 por la condesa doña Elvira. La unidad del conjunto, al que se une su airosa espadaña, la convierten en uno de los monumentos más representativos del románico montañés.
Pisón de Castrejón
En este pueblo destaca su bello templo románico de transición al gótico, en el que destaca su friso con apostolado bajo doseletes, que es muy parecido al que se puede contemplar en la cercana población de Traspeña.",03.11.2023 10:03,larazones,https://www.larazon.es/castilla-y-leon/que-provincia-espanola-tiene-mayor-concentracion-arte-romanico-toda-europa_202311036544b77cf6ca7200014813d6.html
