Título,Cuerpo,Fecha,Periódico,Enlace
"El sombrío momento de Rafael Amargo: prisión, adicciones y líos de familia","Las luces y las sombras se suelen alternar en la vida de los artistas. Es el caso de Rafael Amargo, el gran «bailaor» rupturista e innovador, que ahora se encuentra en la tesitura de sortear un momento oscuro. La Audiencia Provincial de Madrid ha ordenado el ingreso en prisión por quebrantar en varias ocasiones las medidas cautelares y por considerar que existía riesgo de fuga en el marco de su enjuiciamiento por presunto tráfico de drogas, una actividad que desarrollaba en su anterior piso del barrio de Malasaña. Además, en marzo fue detenido en Alicante, pero después se decretó la libertad provisional. En concreto, se le acusa a él, a su mujer y a un socio de adquirir sustancias ilegales para su propio consumo y para comercializarlas. Otro socio acudía a su piso a entregarle el dinero de la venta de las drogas.
Rafael Amargo, de ser detenido por tráfico de drogas a protagonizar contenido erótico gay
Se decreta prisión provisional para Rafael Amargo tras ser detenido
A su entrada en la cárcel de Soto del Real, donde pasará al menos este fin de semana, se suma tener que lidiar con el peso de las adicciones, que le causan otros problemas de salud. Y también tiene que afrontar la enfermedad de su padre, que padece cáncer. Tal como ha relatado su abogado a LA RAZÓN, que el juez dictara un auto de prisión preventiva ha sido algo inesperado y duro para el artista.
«Han pagado justos por pecadores», sostiene Jaime Caballero, que presentará un recurso de súplica para intentar que su representado salga de la cárcel cuanto antes porque su reclusión no hace más que empeorar su situación, señala.  El letrado explica que las medidas adoptadas por el juez se justifican en que Amargo no ha cumplido «de forma escrupulosa con la obligación de firmar quincenalmente». Para justificarlo, presentaron una serie de informes médicos que daban cuenta de los problemas de salud que le impedían acudir. Sin embargo, el tribunal los consideró insuficientes, por lo que dio 15 días al «bailaor» para que presentara un informe psiquiátrico que avalara los trastornos. «No los presentamos», explica Caballero. Según relata, para realizar un informe más acabado, se necesitan cuatro o cinco sesiones y visitas al psiquiatra con una periodicidad, al menos, semanal, con lo cual, el tiempo dado era insuficiente. Por otra parte, el coste de cada cita es de unos 250 euros. Y la situación que afronta actualmente el artista no le permite asumir esos costes tan elevados.
Amargo era consciente de que se podía ordenar su ingreso en prisión, pero pensaba que se aplicarían otras medidas. Sobre el posible riesgo de fuga que habría motivado esta decisión judicial, el abogado la descarta porque carece de pasaporte desde hace tres años. «Creíamos que el juez dictaría alguna medida de menor dureza», como una pulsera de localización o detención domiciliaria. 
¿A qué se debe, pues, la dureza de la decisión judicial? Desde el punto de vista de Caballero, es muy probable que sea por lo que ha calificado como «hartazgo del tribunal». Y no lo atribuye a la actuación de su cliente, sino a la del otro acusado, que ha incurrido en numerosos incumplimientos dilatando la celebración del juicio. De hecho, aseguró, ni siquiera se presentó en la última vista.  Ahora, el juicio está fechado para abril de 2024, después de que se haya tenido que aplazar en numerosas ocasiones porque el otro investigado ha renunciado hasta en cinco momentos distintos a los abogados de oficio. Según su defensor, Amargo ha tenido que pagar las consecuencias con un auto ejemplarizante.
Pero ahora está centrado en intentar que salga de la cárcel. En su recurso de súplica, Caballero dará cuenta de los problemas de salud que aquejan al «bailaor», reconocidos por el informe del propio forense judicial, según sostiene: sus adicciones a sustancias estupefacientes derivan en otros problemas de tipo psiquiátrico, como fobias a los espacios abiertos.
A los reveses en los tribunales y a los trastornos en su propia salud, se suma el difícil momento familiar y todo ello está llevando al límite al artista. No son momentos fáciles para Amargo y «su ingreso en prisión no le ayuda, empeora su situación», asegura el abogado. Solo resta esperar y ver si el lunes el juzgado acoge los argumentos que se presenten en el recurso de súplica y si le permite abandonar la cárcel de Soto del Real.
La enfermedad de su padre y fobia a la calle 
La familia de Rafael Amargo no atraviesa un buen momento. Debido a la adicción que padece por el consumo de sustancias estupefacientes, presenta algunos trastornos que, según sostiene su abogado, le han impedido cumplir escrupulosamente con la obligación de firmar cada 15 días. «A veces es incapaz de salir a la calle», asegura, aunque no lo han podido acreditar con informes psiquiátricos más específicos debido a su coste. Pero lo que más está afectando al artista es el estado de salud de su padre, que padece cáncer, una situación que también afecta negativamente a su estado de ánimo.",04.11.2023 02:20,larazones,https://www.larazon.es/gente/famosos/momento-sombrio-amargo-prision-adicciones-familia_2023110465459c73b276150001966941.html
Puigdemont complica el calendario de Sánchez,"Carles Puigdemont se adueña del control de los tiempos en la negociación para la investidura de Pedro Sánchez. En el PSOE ya se preparan para un fin de semana intenso de negociaciones con la incógnita de si serán capaces de sortear las complicaciones que se están encontrando en el pacto para presentar la ley de amnistía. La idea que contemplaba el PSOE de cerrar antes de este fin de semana el acuerdo con Junts y evitar dilatar todavía más los tiempos, ahora es una esperanza lejana en Ferraz.
Las redes sociales convocan una nueva manifestación en Ferraz en contra de la amnistía
Canarias enfrenta una crisis migratoria sin precedentes en 2023: más de 31.000 llegadas irregulares
Feijóo acusa a Sánchez de ""corrupción"" por el pacto con ERC y carga contra el PNV por votar ""lo mismo"" que Bildu
Tanto es así que en previsión de una negociación larga, el Congreso de los Diputados ha decidido habilitar todos los días hasta el 27 de noviembre –fecha límite para la disolución de las Cortes Generales– para que se pueda celebrar la investidura tanto en día lectivo como festivo. La preferencia de los socialistas sigue siendo los días 8 y 9 de la semana que viene, aunque ahora mismo fuentes de la negociación en Bruselas evitan dar fechas concretas. «No nos ponemos plazos ni presión, esta es la única investidura posible», se defienden ante el nuevo embrollo con Junts. De hecho, ahora insisten en señalar el tiempo que resta hasta que se venza el plazo que lleva a la repetición electoral. Incluso en las filas socialistas se empieza a hablar ahora de la posibilidad de una investidura en la tercera semana del mes.
Este viernes era clave para desatascar las conversaciones y para amarrar el «sí» definitivo de los siete diputados posconvergentes, pero, ahora, en el sector socialista imponen prudencia y discreción y evitan ya de hablar de acuerdo inminente. Todo después de una jornada anterior intensa que quedó truncada en el momento que los socialistas llegaban a un jugoso acuerdo con ERC, que acababa encareciendo el apoyo de los diputados de Puigdemont y alejando la idea de una investidura rápida.
La parte socialista volvía este viernes a Bruselas para tratar de desencallar el acuerdo después de que se levantaran de la mesa el día anterior con discrepancias entorno al alcance que debe tener la futura ley en el Congreso de los Diputados. El número tres del PSOE, Santos Cerdán sigue pilotando las negociaciones en Bruselas con los independentistas, aunque durante todo el día las versiones en el PSOE no hacían más que variar. Al principio, se aseguraba que el secretario de Organización socialista se había visto con Puigdemont, después, fuentes de la negociación lo negaron. Algo que deja entrever el intento de proteger al máximo la negociación pero, también, a sus protagonistas.
Uno de los escollos que aparecía a primera hora de la mañana era que Junts había puesto encima de la mesa nombres concretos que debían ser aceptados por los socialistas en la futura ley de amnistía, como el caso Voloh –aún en fase de investigación y con el jefe de la oficina de Puigdemont y su mano derecha, Josep Lluís Alay como implicado– o el de Laura Borràs, entre otros. De hecho, el secretario general de Junts, Jordi Turull, dejaba claro esta mañana que no dejarían atrás a «ningún soldado» y que no estaban negociando una amnistía para «Vips». Fuentes socialistas de la negociación rechazan que en las reuniones que se están manteniendo se estén aceptando nombres concretos. Enfocan las fricciones de la negociación en aspectos más jurídicos. Aseguran que se están manteniendo «discusiones muy complejas» y que requieren de juristas que supervisen los textos que se van avanzando. De esta manera limitan el impacto del choque con Junts a cuestiones jurídicas legislativas. Al cierre de esta edición las reuniones proseguían, sin desvelarse anuncios sustanciales, ni si finalmente Cerdán se vio con Puigdemont.
En Junts el hermetismo sigue siendo casi total. Casi porque esta mañana se conoció la mencionada carta que Jordi Turull hizo llegar a la ejecutiva del partido, adelantada por «La Vanguardia», en la que el dirigente cargó con dureza contra el pacto del PSOE y ERC, un elemento de presión más en la eterna disputa entre los dos partidos independentistas. La batalla por el relato es importante, Junts lo sabe y juega sus cartas desdeñando las cesiones arrancadas por los republicanos. Además, Turull pidió al resto de miembros de la ejecutiva de Junts «calma», no dejarse «arrastrar» y «confianza» en el liderazgo de Puigdemont, negociador plenipotenciario ante los socialistas.
De hecho, Puigdemont está en Bruselas con el propio Turull y con Míriam Nogueras, diputada en el Congreso. Laura Borràs y su entorno volvieron esta tarde a Barcelona, otra muestra más de quién es el núcleo duro y del blindaje decretado en el espacio posconvergente.
Mientras PSOE y Junts siguen sin atar el acuerdo, las presiones del independentismo más radical van ""in crescendo"": en este sentido, este viernes se han expresado tanto los CDR como la ANC en contra de la investidura de Sánchez. No obstante, visto el precedente de la consulta del Consell per la República, que votó en contra de esa investidura y Puigdemont lo ha desoído, se antoja complicado que surtan efecto estas presiones.",03.11.2023 19:32,larazones,https://www.larazon.es/espana/puigdemont-complica-calendario-sanchez_2023110365453cbc32499c0001ba2bff.html
Los aceites esenciales de dos condimentos que usas a diario reducen el riesgo de infarto ,"Dos de los condimentos más usados en la gastronomía española, el orégano y el tomillo, tienen un potente efecto prebiótico y antioxidante, y su consumo frecuente ayuda a reducir el riesgo cardiometabólico severo. Así lo demuestra una investigación en ratones liderada por científicos del Instituto de Investigación Biomédica de Málaga y Plataforma en Nanomedicina, el Hospital Universitario Virgen de la Victoria y la Universidad de Málaga (UMA) que evidencia que el uso de estos ingredientes-administrados como nutracéuticos- mejora los factores de riesgo para la salud cardiovascular, incluyendo el colesterol.
El medicamento de toda la vida que protege frente al cáncer colorrectal 
El motivo de salud por el que no debe secar los calcetines en el radiador
Los nutracéuticos son complementos alimenticios, en forma de comprimidos, cápsulas, líquidos, gomas o polvos, que contienen nutrientes como vitaminas, aminoácidos, minerales, extractos de plantas y otros. Los microorganismos vivos presentes en estos compuestos han demostrado que pueden ayudar a prevenir y tratar diversas enfermedades crónicas, como el síndrome del intestino irritable, la enfermedad inflamatoria intestinal y la obesidad, así como otras enfermedades relacionadas con la microbiota intestinal.
Para realizar esta investigación se utilizó un método innovador, que integró el análisis de múltiples tipos de datos biológicos, utilizando un modelo humanizado de ratón al que se trasplantó microbiota intestinal de pacientes con enfermedad coronaria (CAD) y diabetes tipo 2 (T2DM). El objetivo era explorar los efectos de los aceites esenciales de tomillo y orégano administrados como nutracéuticos para el manejo de una condición cardiometabólica compleja. 
Los científicos estudiaron el efecto de estos dos nutracéuticos por medio del análisis exhaustivo de las proteínas del tejido cardíaco, revelando los mecanismos moleculares por los que los aceites esenciales regulan la función de las mitocondrias, el estrés oxidativo y la contracción cardíaca, indicó la Junta de Andalucía en un comunicado.
También analizaron el microbioma de los animales después de administrarles los aceites esenciales de tomillo y romero, y observaron un aumento de bacterias beneficiosas- como la Lactobacillus- y de los niveles de ácidos grasos beneficiosos de cadena corta (SCFA) en las muestras fecales, además de la disminución del género bacteriano perjudicial Colidextribacter. Estos cambios en la microbiota intestinal tiene implicaciones importantes en la salud metabólica y la respuesta inflamatoria, dos aspectos clave de los trastornos cardiometabólicos.
""Se validó el poder antioxidante de la administración de los aceites esenciales al reducir los niveles plasmáticos de moléculas oxidantes, al mismo tiempo que se observó una mejoría en los factores de riesgo para la salud cardiovascular, incluyendo el colesterol"", explicó la investigadora del grupo Investigación Cardiovascular para la Salud de Ibima Plataforma Bionand, María José Sánchez, según recoge Ep.",03.11.2023 18:18,larazones,https://www.larazon.es/salud/aceites-esenciales-dos-condimentos-que-usas-diario-reducen-riesgo-infarto_2023110365452b59b276150001958dcb.html
Vivir en el infierno minado de Kamianka,"Ilona llora desconsolada delante de la casa de sus padres, destruida por los bombardeos de las tropas rusas. “Cuando abandonamos este lugar, hace más de un año, estaba embarazada de mi segundo hijo”, dice la joven, de 27 años, mientras intenta mantener la compostura. Quiere entrar en la vivienda situada en la pequeña aldea de Kamianka, cerca de la ciudad de Izium, pero eso le podría costar la vida. El patio y el bosque de alrededor están sembrados con minas antipersonales y las muy peligrosas y casi invisibles entre el follaje, minas mariposa, las cuales parecen un juguete y están diseñadas no para matar, sino para cercenar brazos y piernas, sobre todo entre los niños.
Guerra entre Israel y Hamás, en directo: tanques israelíes rodean la Ciudad de Gaza y hay combates cuerpo a cuerpo
Un terremoto de magnitud 6,4 deja al menos 136 personas muertas en Nepal
Las enfermizas fotos que Brueckner le hizo a Madeleine McCann antes de deshacerse del cuerpo 
“Es muy probable que el interior esté plagado de minas trampa colocadas por los rusos”, explica Yuri, el jefe del equipo de investigación de la Fondation Suisse de Déminage (FSD) desplazado en la población. La organización trabaja en Ucrania desde 2015. Opera en las provincias de Kyiv, Chernihiv y Járkov, con actividades puntuales en Mykolaiv y Odessa. “Contamos con diez equipos especializados en limpieza de campos de batalla, dos equipos de limpieza con máquinas, dos que limpian edificios derrumbados utilizando vehículos de construcción blindados, diez equipos de inspección no técnica y cuatro centrados en informar sobre el riesgo de las municiones explosivas. En total, más de 200 personas”, explica Eleanor Porritt, una de sus jefas de operaciones en Járkov.
“Es un horror, el pueblo está destrozado”, concluye Ilona, rota, sollozando, antes de meterse en el coche y abandonar este pueblo convertido en un basurero de guerra. Y tiene razón. No hay ni una sola casa que no haya recibido al menos un impacto de artillería, así como fueron saqueadas a conciencia por los soldados del Kremlin, que establecieron aquí un rudimentario sistema de trincheras y varias posiciones para sus cañones y tanques.
Solo 164 de los 2000 habitantes que había permanecen, o han vuelto, a sus casas desventradas, sin gas, agua o electricidad. “Se lo llevaron todo. Los rusos nos han robado la vida, pero gracias a nuestros ‘chicos’ hemos podido volver. Ahora vivo en Izium con mi nieto de 14 años. De momento no podemos volver, mi casa es un montón de piedras, pero ojalá nos ayuden a regresar pronto”, explica Tatiana, de 57 años, intentando esbozar una sonrisa por la que asoman varios dientes de oro.
Seguidamente, conducimos lentamente por varios caminos marcados con estacas en las que un triángulo rojo con una calavera y dos huesos cruzados establecen la frontera entre la vida y la muerte. A ambos lados de la carretera los esqueletos oxidados y carbonizados de varios vehículos, incluidos algunos blindados rusos, hacen patente la crudeza de los combates que tuvieron lugar en esta población. Destaca un viejo coche Lada de color naranja partido por la mitad al ser arrollado por un tanque ruso. “Ahí murió una familia entera mientras intentaba huir”, cuenta Yuri.
Al salir del coche, el jefe es bien claro: “no camines fuera del camino marcado. No pises la hierba a ambos lados, no entres en ningún cobertizo o casa. Lo mejor es que me sigas y pises donde lo haga yo. Hace unos días uno de los vecinos perdió una pierna en esta carretera”, explica, junto a una montaña de cajas verdes de munición vacías abandonadas por el Ejército ruso. A unos 300 metros, Yuri se detiene. “Más allá es imposible ir, si quieres seguir de una pieza”, dice, a la vez que tres operarios de su equipo preparan un dron con el que van a marcar las minas y los proyectiles que no han explotado.
El aparato asciende hasta el cielo con su característico zumbido de abejorro gigante. A través de la cámara, no tardan en encontrar sus objetivos. Granadas de mano, cohetes para los lanzagranadas RPG, obuses clavados en el suelo que no estallaron, minas antipersonales y antitanque. “Estas son las más difíciles de ver”, explica Mariya, expolicía y ahora directora de comunicaciones del FSD, “porque la hierba está muy crecida”. A su lado, otro integrante del grupo apunta en un mapa de papel la localización exacta de cada artefacto. “El GPS del dron es una herramienta muy buena, pero hemos pedido uno que tenga cámara térmica para facilitar el trabajo. Ojalá llegue pronto”, añade.
“Cuando tengamos toda la zona mapeada e identificada, entonces será el turno de los equipos que las extraen del terreno”, indica Tania, quien antes de las hostilidades, “que en mi hogar comenzaron en 2014”, recalca, trabajaba como farmacéutica en Slovinask, y ahora arriesga su vida como técnica del FSD porque “esta es mi tierra, quiero que mis hijos crezcan libres en su país”. Los motivos de Mariya son similares. “Me siento feliz haciendo este trabajo. Quiero ayudar a la gente y esta es la mejor manera que tengo de hacerlo”. Por su parte, Yuri, que antes de la guerra era ingeniero y experto en telecomunicaciones, dice que “no me he alistado porque no me siento preparado para matar a nadie. No está en mi naturaleza. Al principio de los combates trabajaba como voluntario cerca del frente, pero con lo que hago ahora puedo ayudar a mucha más gente”.
Otro de los vecinos se acerca. “Vengo de pescar en el pequeño lago que hay allá abajo”, indica con el brazo Sergeiy, de 67 años, hacia una zona boscosa. ¿No es peligroso? “Claro, pero, ¿qué le voy a hacer? Aquí está mi casa, mi vida. He despejado lo que podía yo mismo”, algo que bordea el suicidio, “y con los vecinos hemos abierto un camino con el tractor hasta la ribera. Tenemos que comer, todavía hay peces. Los animales que tenía, vacas y cerdos, los rusos los mataron o se los comieron. Hui nada más verlos llegar y cuando volví, en mayo de este año, mi casa estaba en ruinas y no quedaba nada”. El hombre nos lleva hasta lo que era su vivienda, donde sobrevive con su mujer.
Han construido un cobertizo de madera para refugiarse entre los escombros del jardín, en el que ha apilado cajas de munición rusas, pedazos de uniformes, botas, cascos y demás pertrechos que las tropas del Kremlin abandonaron. “Construí esta casa con mis manos, y lo volveré hacer, pero ya soy mayor y el invierno no tardará en llegar. Necesitamos ayuda”, explica mientras se da la vuelta. “Un momento, os enseño algo”, dice. Después de unos segundos sorteando la herrumbre en la que se ha convertido todo lo que poseía vuelve, sonriente, con una granada en la mano. “Tenía un cubo lleno. Se las di a los soldados ucranianos. Tranquilos, le he quitado la espoleta”, indica al ver nuestras caras de circunstancias.
Cuando el sol está decayendo, el equipo se detiene junto a un vehículo blindado chamuscado donde varias banderas amarillas y azules ondean al viento junto a las fotografías de los dos soldados ucranianos que murieron en el interior. Delante hay un cubo de rosas rojas medio marchitas. “Es una tumba y un monumento”, dice Yuri. “Es hora de marchar, por la noche este lugar es una trampa mortal”. Antes de partir, el miembro del FSD recuerda:
“Por cada mes de guerra se necesita un año para limpiar los campos de minas y artefactos explosivos. Si tuviéramos 100.000 desactivadores, quizás podríamos acabar el trabajo en esta década. Pero solo contamos con 5.000. Haz las cuentas tú mismo. E incluso encontramos artefactos de la Segunda Guerra Mundial, porque aquí se produjeron grandes batallas entonces. Queda mucho, mucho trabajo por hacer”, concluye, apesadumbrado.",04.11.2023 02:18,larazones,https://www.larazon.es/internacional/vivir-infierno-minado-kamianka_2023110465459bd3b2761500019667ea.html
"¿Qué es la ""carta del miedo"" que está mandando Hacienda? Estos son los españoles que la recibirán antes de Navidad","Todos los años millones de contribuyentes tienen que acudir a la cita anual con la Agencia Tributaria para presentar sus declaraciones de IRPF y Patrimonio en la campaña de la Renta. No obstante, aunque rendir cuenta con Hacienda es una obligación para muchos españoles antes de que esta campaña termine a finales de junio, no todos los ciudadanos tienen sus cuentas al día. Por ello, la Agencia Tributaria está aprovechando los últimos meses del año para enviar a los contribuyentes las ""cartas del miedo"". Pero, ¿qué son estas cartas? Por norma general son notificaciones del organismo público cuando ha detectado alguna irregularidad, incidencia fiscal o solicita información adicional a los ciudadanos. Tan solo el año pasado se enviaron alrededor de 1,2 millones de cartas de Hacienda.
El precio de la luz será de 0 euros/MWh mañana domingo desde la medianoche hasta las 18.00 horas
El precio de la luz se desploma hoy al mínimo en casi tres años y será gratis o casi nueve horas
Playmobil, en la crisis de los 50: las míticas figuras pierden la sonrisa por la caída de ventas
Estas cartas suelen enviarse por correo postal, aunque el contribuyente también podrá recibir esta notificación por correo electrónico, siempre y cuando la Agencia Tributaria tenga su email.
No todas las notificaciones son iguales, sino que desde Tax Down señalan que existen diferentes tipos de notificaciones que se pueden clasificar según su contenido:
En el caso de la declaración hubiera salido a pagar y no se haya respondido, el contribuyente deberá abonar un recargo de un 5% sobre la cantidad que se ha dejado de pagar. Aunque si, por el contrario, se llega a recibir la ""carta del miedo"", el recargo puede ascender desde el 10% hasta el 20% de lo dejado por pagar.
Por otro lado, la Agencia Tributaria tiene un periodo de hasta 4 años de tiempo para revisar los trámites fiscales por el impuesto de la renta de las personas físicas. Por lo que a pesar de que ya haya finalizado la campaña de este año correspondiente a la declaración del ejercicio de 2022, hasta el año 2027 podría llegarnos una notificación de algún fallo detectado en dicha declaración.",03.11.2023 12:27,larazones,https://www.larazon.es/economia/que-carta-miedo-que-esta-mandando-hacienda-estos-son-espanoles-que-recibiran-antes-navidad_202311036544d90cb276150001947e4a.html
